Glareola ocularis, Glareola ocularis,3596817
Glareola cinerea, Glareola cinerea,3596816
Pterocles indicus, Pterocles indicus,3596814
Pterocles lichtensteinii, Pterocles lichtensteinii,3596813
Pterocles personatus, Pterocles personatus,3596812
Pterocles decoratus, Pterocles decoratus,3596811
Pterocles burchelli, Pterocles burchelli,3596810
Pterocles senegallus, Pterocles senegallus,3596809
Pterocles quadricinctus, Pterocles quadricinctus,3596808
Pterocles alchata, Pterocles alchata,3596807
Syrrhaptes tibetanus, Syrrhaptes tibetanus,3596806
Leptoptilos crumenifer, Leptoptilos crumenifer,3596802
Leptoptilos dubius, Leptoptilos dubius,3596801
Tigriornis leucolopha, Tigriornis leucolopha,3596788
Zonerodius heliosylus, Zonerodius heliosylus,3596785
Egretta ardesiaca, Egretta ardesiaca,3596779
Egretta vinaceigula, Egretta vinaceigula,3596778
Egretta gularis, Egretta gularis,3596775
Egretta picata, Egretta picata,3596774
Gorsachius goisagi, Gorsachius goisagi,3596773
Gorsachius leuconotus, Gorsachius leuconotus,3596772
Gorsachius melanolophus, Gorsachius melanolophus,3596771
Ardeola speciosa, Ardeola speciosa,3596770
Ardeola grayii, Ardeola grayii,3596769
Botaurus poiciloptilus, Botaurus poiciloptilus,3596765
Tigrisoma mexicanum, Tigrisoma mexicanum,3596764
Ixobrychus dubius, Ixobrychus dubius,3596763
Ixobrychus novaezelandiae, Ixobrychus novaezelandiae,3596761
Ardea humbloti, Ardea humbloti,3596746
Ardea sumatrana, Ardea sumatrana,3596745
Ardea goliath, Ardea goliath,3596743
Ardea insignis, Ardea insignis,3596742
Ardea melanocephala, Ardea melanocephala,3596741
Cercibis oxycerca, Cercibis oxycerca,3596740
Pseudibis davisoni, Pseudibis davisoni,3596739
Bostrychia rara, Bostrychia rara,3596737
Bostrychia olivacea, Bostrychia olivacea,3596736
Bostrychia hagedash, Bostrychia hagedash,3596735
Bostrychia bocagei, Bostrychia bocagei,3596733
Pseudibis papillosa, Pseudibis papillosa,3596732
Bostrychia carunculata, Bostrychia carunculata,3596728
Lophotibis cristata, Lophotibis cristata,3596725
Pseudibis gigantea, Pseudibis gigantea,3596723
Theristicus branickii, Theristicus branickii,3596720
Threskiornis spinicollis, Threskiornis spinicollis,3596718
Threskiornis bernieri, Threskiornis bernieri,3596714
Threskiornis solitarius, Threskiornis solitarius,3596700
Microgoura meeki, Microgoura meeki,3596683
Starnoenas cyanocephala, Starnoenas cyanocephala,3596672
Cryptophaps poecilorrhoa, Cryptophaps poecilorrhoa,3596665
Petrophassa rufipennis, Petrophassa rufipennis,3596664
Gymnophaps mada, Gymnophaps mada,3596663
Gymnophaps solomonensis, Gymnophaps solomonensis,3596662
Gymnophaps stalkeri, Gymnophaps stalkeri,3596661
Geophaps scripta, Geophaps scripta,3596659
Geophaps smithii, Geophaps smithii,3596658
Patagioenas corensis, Patagioenas corensis,3596657
Patagioenas goodsoni, Patagioenas goodsoni,3596656
Patagioenas caribaea, Patagioenas caribaea,3596655
Treron phayrei, Treron phayrei,3596654
Treron affinis, Treron affinis,3596653
Treron teysmannii, Treron teysmannii,3596652
Treron sanctithomae, Treron sanctithomae,3596651
Treron phoenicopterus, Treron phoenicopterus,3596650
Treron fulvicollis, Treron fulvicollis,3596649
Treron chloropterus, Treron chloropterus,3596648
Treron seimundi, Treron seimundi,3596647
Treron griseicauda, Treron griseicauda,3596646
Treron bicinctus, Treron bicinctus,3596645
Treron pembaensis, Treron pembaensis,3596643
Treron curvirostra, Treron curvirostra,3596642
Treron floris, Treron floris,3596641
Treron psittaceus, Treron psittaceus,3596640
Treron aromaticus, Treron aromaticus,3596639
Treron sphenurus, Treron sphenurus,3596638
Treron apicauda, Treron apicauda,3596637
Treron capellei, Treron capellei,3596636
Treron olax, Treron olax,3596635
Treron oxyurus, Treron oxyurus,3596634
Paraclaravis geoffroyi, Claravis geoffroyi,3596632
Paraclaravis mondetoura, Claravis mondetoura,3596630
Macropygia ruficeps, Macropygia ruficeps,3596629
Macropygia unchall, Macropygia unchall,3596628
Macropygia magna, Macropygia magna,3596627
Macropygia emiliana, Macropygia emiliana,3596626
Macropygia rufipennis, Macropygia rufipennis,3596625
Phapitreron brunneiceps, Phapitreron brunneiceps,3596624
Phapitreron cinereiceps, Phapitreron cinereiceps,3596623
Goura scheepmakeri, Goura scheepmakeri,3596621
Geotrygon chrysia, Geotrygon chrysia,3596620
Zentrygon linearis, Geotrygon linearis,3596619
Zentrygon carrikeri, Geotrygon carrikeri,3596618
Geotrygon caniceps, Geotrygon caniceps,3596617
Geotrygon leucometopia, Geotrygon leucometopia,3596616
Geotrygon mystacea, Geotrygon mystacea,3596615
Geopelia maugeus, Geopelia maugei,3596614
Geopelia placida, Geopelia placida,3596612
Geopelia humeralis, Geopelia humeralis,3596611
Leptotila ochraceiventris, Leptotila ochraceiventris,3596608
Leptotila wellsi, Leptotila wellsi,3596607
Leptotila conoveri, Leptotila conoveri,3596606
Leptotila pallida, Leptotila pallida,3596605
Phaps histrionica, Phaps histrionica,3596604
Phaps elegans, Phaps elegans,3596603
Ptilinopus porphyreus, Ptilinopus porphyreus,3596600
Ptilinopus chalcurus, Ptilinopus chalcurus,3596599
Ptilinopus mangoliensis, Ptilinopus mangoliensis,3596598
Ptilinopus epius, Ptilinopus epius,3596597
Ptilinopus insolitus, Ptilinopus insolitus,3596596
Ptilinopus coronulatus, Ptilinopus coronulatus,3596595
Ptilinopus pelewensis, Ptilinopus pelewensis,3596593
Ptilinopus dupetithouarsii, Ptilinopus dupetithouarsii,3596592
Ptilinopus merrilli, Ptilinopus merrilli,3596591
Ptilinopus aurantiifrons, Ptilinopus aurantiifrons,3596590
Ptilinopus roseicapilla, Ptilinopus roseicapilla,3596588
Ptilinopus insularis, Ptilinopus insularis,3596587
Ptilinopus wallacii, Ptilinopus wallacii,3596586
Ptilinopus subgularis, Ptilinopus subgularis,3596585
Ptilinopus monacha, Ptilinopus monacha,3596584
Ptilinopus granulifrons, Ptilinopus granulifrons,3596583
Ptilinopus tannensis, Ptilinopus tannensis,3596582
Ptilinopus iozonus, Ptilinopus iozonus,3596581
Ptilinopus greyi, Ptilinopus greyii,3596580
Ptilinopus nainus, Ptilinopus nainus,3596579
Ptilinopus mercierii, Ptilinopus mercierii,3596578
Ptilinopus bernsteinii, Ptilinopus bernsteinii,3596577
Ptilinopus perlatus, Ptilinopus perlatus,3596576
Ptilinopus fischeri, Ptilinopus fischeri,3596575
Ptilinopus cinctus, Ptilinopus cinctus,3596574
Ptilinopus alligator, Ptilinopus cinctus,3596574
Ptilinopus coralensis, Ptilinopus coralensis,3596573
Ptilinopus viridis, Ptilinopus viridis,3596572
Ptilinopus ornatus, Ptilinopus ornatus,3596571
Ptilinopus dohertyi, Ptilinopus dohertyi,3596570
Ptilinopus purpuratus, Ptilinopus purpuratus,3596569
Ptilinopus layardi, Ptilinopus layardi,3596568
Ptilinopus hyogastrus, Ptilinopus hyogastrus,3596567
Ptilinopus arcanus, Ptilinopus arcanus,3596566
Ptilinopus eugeniae, Ptilinopus eugeniae,3596565
Ptilinopus marchei, Ptilinopus marchei,3596564
Ptilinopus huttoni, Ptilinopus huttoni,3596563
Ptilinopus porphyraceus, Ptilinopus porphyraceus,3596562
Ptilinopus perousii, Ptilinopus perousii,3596561
Ptilinopus jambu, Ptilinopus jambu,3596560
Ducula mindorensis, Ducula mindorensis,3596559
Ducula latrans, Ducula latrans,3596558
Ducula basilica, Ducula basilica,3596557
Ducula neglecta, Ducula neglecta,3596556
Ducula poliocephala, Ducula poliocephala,3596555
Ducula forsteni, Ducula forsteni,3596554
Ducula cineracea, Ducula cineracea,3596553
Ducula goliath, Ducula goliath,3596552
Ducula chalconota, Ducula chalconota,3596551
Ducula mullerii, Ducula mullerii,3596550
Ducula radiata, Ducula radiata,3596549
Ducula oceanica, Ducula oceanica,3596548
Ducula perspicillata, Ducula perspicillata,3596547
Ducula lacernulata, Ducula lacernulata,3596546
Ducula pickeringii, Ducula pickeringii,3596545
Ducula carola, Ducula carola,3596544
Ducula galeata, Ducula galeata,3596543
Ducula nicobarica, Ducula nicobarica,3596542
Ducula badia, Ducula badia,3596541
Ducula bakeri, Ducula bakeri,3596540
Ducula myristicivora, Ducula myristicivora,3596538
Ducula whartoni, Ducula whartoni,3596537
Ducula brenchleyi, Ducula brenchleyi,3596536
Ducula finschii, Ducula finschii,3596535
Ducula concinna, Ducula concinna,3596534
Ducula aurorae, Ducula aurorae,3596533
Ducula rosacea, Ducula rosacea,3596532
Turtur abyssinicus, Turtur abyssinicus,3596530
Caloenas maculata, Caloenas maculata,3596529
Alectroenas nitidissimus, Alectroenas nitidissima,3596526
Alectroenas pulcherrimus, Alectroenas pulcherrima,3596525
Alectroenas sganzini, Alectroenas sganzini,3596524
Chalcophaps longirostris, Chalcophaps longirostris,3596523
Alopecoenas salamonis, Alopecoenas salamonis,3596519
Gallicolumba menagei, Gallicolumba menagei,3596518
Columbina buckleyi, Columbina buckleyi,3596517
Columbina cyanopis, Columbina cyanopis,3596516
Turacoena modesta, Turacoena modesta,3596514
Henicophaps foersteri, Henicophaps foersteri,3596513
Columba albinucha, Columba albinucha,3596512
Columba sjostedti, Columba sjostedti,3596511
Columba leuconota, Columba leuconota,3596509
Columba leucomela, Columba leucomela,3596508
Columba torringtoniae, Columba torringtoniae,3596506
Columba thomensis, Columba thomensis,3596505
Columba pollenii, Columba pollenii,3596504
Columba delegorguei, Columba delegorguei,3596503
Columba punicea, Columba punicea,3596502
Columba palumboides, Columba palumboides,3596501
Columba unicincta, Columba unicincta,3596500
Columba jouyi, Columba jouyi,3596499
Columba hodgsonii, Columba hodgsonii,3596498
Columba albitorques, Columba albitorques,3596497
Columba eversmanni, Columba eversmanni,3596494
Columba argentina, Columba argentina,3596492
Columba malherbii, Columba malherbii,3596490
Columba versicolor, Columba versicolor,3596489
Columba larvata, Aplopelia larvata,3596487
Columba iriditorques, Columba iriditorques,3596485
Columba pallidiceps, Columba pallidiceps,3596484
Columba elphinstonii, Columba elphinstonii,3596483
Columba oliviae, Columba oliviae,3596482
Columba trocaz, Columba trocaz,3596481
Streptopelia lugens, Streptopelia lugens,3596480
Streptopelia reichenowi, Streptopelia reichenowi,3596478
Reinwardtoena crassirostris, Reinwardtoena crassirostris,3596476
Reinwardtoena reinwardti, Reinwardtoena reinwardtii,3596474
Corythornis madagascariensis, Corythornis madagascariensis,3596464
Corythornis vintsioides, Corythornis vintsioides,3596463
Caridonax fulgidus, Caridonax fulgidus,3596460
Coracias benghalensis, Coracias benghalensis,3596441
Coracias temminckii, Coracias temminckii,3596440
Coracias cyanogaster, Coracias cyanogaster,3596438
Coracias naevius, Coracias naevius,3596437
Eurystomus azureus, Eurystomus azureus,3596436
Aspatha gularis, Aspatha gularis,3596435
Momotus lessonii, Momotus lessonii,3596433
Momotus bahamensis, Momotus bahamensis,3596432
Momotus subrufescens, Momotus subrufescens,3596431
Momotus coeruliceps, Momotus coeruliceps,3596430
Momotus aequatorialis, Momotus aequatorialis,3596429
Electron carinatum, Electron carinatum,3596428
Megaceryle lugubris, Megaceryle lugubris,3596426
Merops mentalis, Merops mentalis,3596422
Merops revoilii, Merops revoilii,3596420
Nyctyornis athertoni, Nyctyornis athertoni,3596419
Brachypteracias squamiger, Brachypteracias squamiger,3596417
Pelargopsis melanorhyncha, Pelargopsis melanorhyncha,3596411
Pelargopsis amauroptera, Pelargopsis amauroptera,3596410
Actenoides monachus, Actenoides monachus,3596409
Actenoides bougainvillei, Actenoides bougainvillei,3596408
Actenoides hombroni, Actenoides hombroni,3596407
Actenoides princeps, Actenoides princeps,3596406
Syma megarhyncha, Syma megarhyncha,3596405
Tanysiptera carolinae, Tanysiptera carolinae,3596404
Tanysiptera hydrocharis, Tanysiptera hydrocharis,3596403
Tanysiptera riedelii, Tanysiptera riedelii,3596402
Tanysiptera nympha, Tanysiptera nympha,3596401
Tanysiptera sylvia, Tanysiptera sylvia,3596400
Tanysiptera danae, Tanysiptera danae,3596399
Tanysiptera ellioti, Tanysiptera ellioti,3596398
Tanysiptera nigriceps, Tanysiptera nigriceps,3596397
Todiramphus enigma, Todiramphus enigma,3596392
Todiramphus tutus, Todiramphus tutus,3596391
Todiramphus recurvirostris, Todiramphus recurvirostris,3596390
Todiramphus gambieri, Todiramphus gambieri,3596389
Todiramphus australasia, Todiramphus australasia,3596388
Todiramphus leucopygius, Todiramphus leucopygius,3596387
Todiramphus nigrocyaneus, Todiramphus nigrocyaneus,3596386
Todiramphus lazuli, Todiramphus lazuli,3596385
Todiramphus diops, Todiramphus diops,3596384
Todiramphus godeffroyi, Todiramphus godeffroyi,3596382
Todiramphus veneratus, Todiramphus veneratus,3596381
Todiramphus farquhari, Todiramphus farquhari,3596380
Todiramphus pyrrhopygius, Todiramphus pyrrhopygius,3596379
Todiramphus saurophagus, Todiramphus saurophagus,3596378
Todiramphus albonotatus, Todiramphus albonotatus,3596377
Todiramphus funebris, Todiramphus funebris,3596376
Halcyon cyanoventris, Halcyon cyanoventris,3596372
Halcyon albiventris, Halcyon albiventris,3596371
Halcyon pileata, Halcyon pileata,3596370
Halcyon chelicuti, Halcyon chelicuti,3596369
Halcyon senegaloides, Halcyon senegaloides,3596368
Dacelo tyro, Dacelo tyro,3596366
Dromococcyx pavoninus, Dromococcyx pavoninus,3596365
Neomorphus radiolosus, Neomorphus radiolosus,3596364
Neomorphus pucheranii, Neomorphus pucheranii,3596363
Neomorphus squamiger, Neomorphus squamiger,3596362
Cercococcyx mechowi, Cercococcyx mechowi,3596361
Cercococcyx olivinus, Cercococcyx olivinus,3596360
Clamator levaillantii, Clamator levaillantii,3596359
Clamator coromandus, Clamator coromandus,3596358
Surniculus musschenbroeki, Surniculus musschenbroeki,3596357
Surniculus dicruroides, Surniculus dicruroides,3596356
Surniculus velutinus, Surniculus velutinus,3596355
Cacomantis sonneratii, Cacomantis sonneratii,3596354
Cacomantis castaneiventris, Cacomantis castaneiventris,3596353
Cacomantis leucolophus, Cacomantis leucolophus,3596352
Cacomantis pallidus, Cacomantis pallidus,3596351
Cacomantis passerinus, Cacomantis passerinus,3596350
Chrysococcyx meyerii, Chrysococcyx meyeri,3596349
Chrysococcyx megarhynchus, Chrysococcyx megarhynchus,3596347
Chrysococcyx ruficollis, Chrysococcyx ruficollis,3596346
Chrysococcyx xanthorhynchus, Chrysococcyx xanthorhynchus,3596344
Chrysococcyx maculatus, Chrysococcyx maculatus,3596342
Chrysococcyx cupreus, Chrysococcyx cupreus,3596340
Chrysococcyx caprius, Chrysococcyx caprius,3596339
Hierococcyx pectoralis, Hierococcyx pectoralis,3596336
Hierococcyx varius, Hierococcyx varius,3596335
Hierococcyx fugax, Hierococcyx fugax,3596334
Hierococcyx vagans, Hierococcyx vagans,3596333
Coua verreauxi, Coua verreauxi,3596330
Coua gigas, Coua gigas,3596329
Coua coquereli, Coua coquereli,3596328
Coua delalandei, Coua delalandei,3596327
Carpococcyx radiceus, Carpococcyx radiceus,3596326
Carpococcyx viridis, Carpococcyx viridis,3596325
Eudynamys melanorhynchus, Eudynamys melanorhyncha,3596323
Eudynamys orientalis, Eudynamys orientalis,3596321
Hierococcyx hyperythrus, Hierococcyx hyperythrus,3596320
Hierococcyx nisicolor, Hierococcyx nisicolor,3596316
Cuculus lepidus, Cuculus lepidus,3596315
Cuculus clamosus, Cuculus clamosus,3596314
Cuculus gularis, Cuculus gularis,3596312
Cuculus solitarius, Cuculus solitarius,3596309
Cuculus crassirostris, Cuculus crassirostris,3596308
Cuculus micropterus, Cuculus micropterus,3596307
Cuculus rochii, Cuculus rochii,3596306
Coccyzus vetula, Coccyzus vetula,3596305
Coccyzus rufigularis, Coccyzus rufigularis,3596304
Coccyzus pluvialis, Coccyzus pluvialis,3596303
Coccyzus euleri, Coccyzus euleri,3596302
Coccyzus lansbergi, Coccyzus lansbergi,3596300
Coccycua pumila, Coccyzus pumilus,3596299
Coccyzus ferrugineus, Coccyzus ferrugineus,3596298
Coccyzus longirostris, Coccyzus longirostris,3596296
Coccyzus merlini, Coccyzus merlini,3596295
Chelictinia riocourii, Chelictinia riocourii,3596294
Erythrotriorchis radiatus, Erythrotriorchis radiatus,3596292
Erythrotriorchis buergersi, Erythrotriorchis buergersi,3596290
Megatriorchis doriae, Megatriorchis doriae,3596277
Spilornis klossi, Spilornis klossi,3596259
Spilornis kinabaluensis, Spilornis kinabaluensis,3596258
Elanus axillaris, Elanus axillaris,3596257
Leptodon forbesi, Leptodon forbesi,3596250
Butastur liventer, Butastur liventer,3596249
Henicopernis infuscatus, Henicopernis infuscatus,3596248
Aviceda jerdoni, Aviceda jerdoni,3596247
Aviceda leuphotes, Aviceda leuphotes,3596245
Nisaetus floris, Nisaetus floris,3596234
Nisaetus pinskeri, Nisaetus pinskeri,3596233
Hieraaetus weiskei, Hieraaetus weiskei,3596232
Accipiter nanus, Accipiter nanus,3596227
Accipiter albogularis, Accipiter albogularis,3596226
Accipiter griseiceps, Accipiter griseiceps,3596225
Accipiter trinotatus, Accipiter trinotatus,3596224
Accipiter collaris, Accipiter collaris,3596223
Accipiter butleri, Accipiter butleri,3596222
Accipiter luteoschistaceus, Accipiter luteoschistaceus,3596220
Accipiter hiogaster, Accipiter hiogaster,3596219
Accipiter princeps, Accipiter princeps,3596218
Accipiter brachyurus, Accipiter brachyurus,3596217
Accipiter haplochrous, Accipiter haplochrous,3596216
Accipiter rhodogaster, Accipiter rhodogaster,3596215
Accipiter rufitorques, Accipiter rufitorques,3596213
Accipiter fasciatus, Accipiter fasciatus,3596212
Accipiter poliocephalus, Accipiter poliocephalus,3596210
Accipiter henicogrammus, Accipiter henicogrammus,3596209
Accipiter meyerianus, Accipiter meyerianus,3596208
Accipiter erythrauchen, Accipiter erythrauchen,3596206
Clanga hastata, Aquila hastata,3596196
Circus macrosceles, Circus macrosceles,3596195
Circus maurus, Circus maurus,3596194
Circus maillardi, Circus maillardi,3596193
Circus melanoleucos, Circus melanoleucos,3596192
Circus hudsonius, Circus hudsonius,3596190
Circus spilothorax, Circus spilothorax,3596188
Buteogallus gundlachii, Buteogallus gundlachii,3596183
Circaetus beaudouini, Circaetus beaudouini,3596182
Pernis steerei, Pernis steerei,3596177
Buteo bannermani, Buteo bannermani,3596171
Buteo socotraensis, Buteo socotraensis,3596165
Microhierax melanoleucos, Microhierax melanoleucos,3596150
Microhierax latifrons, Microhierax latifrons,3596149
Microhierax fringillarius, Microhierax fringillarius,3596148
Polihierax insignis, Polihierax insignis,3596147
Caracara lutosa, Caracara lutosa,3596146
Falco moluccensis, Falco moluccensis,3596145
Falco alopex, Falco alopex,3596144
Falco severus, Falco severus,3596139
Falco hypoleucos, Falco hypoleucos,3596135
Falco ardosiaceus, Falco ardosiaceus,3596132
Synoicus monorthonyx, Anurophasis monorthonyx,3596096
Melanoperdix niger, Melanoperdix niger,3596095
Lerwa lerwa, Lerwa lerwa,3596087
Ophrysia superciliosa, Ophrysia superciliosa,3596083
Tetrastes sewerzowi, Tetrastes sewerzowi,3596073
Tetraogallus caucasicus, Tetraogallus caucasicus,3596071
Galloperdix bicalcarata, Galloperdix bicalcarata,3596070
Galloperdix spadicea, Galloperdix spadicea,3596069
Ammoperdix griseogularis, Ammoperdix griseogularis,3596066
Perdicula manipurensis, Perdicula manipurensis,3596065
Perdicula argoondah, Perdicula argoondah,3596064
Perdicula erythrorhyncha, Perdicula erythrorhyncha,3596063
Arborophila mandellii, Arborophila mandellii,3596062
Arborophila campbelli, Arborophila campbelli,3596061
Arborophila crudigularis, Arborophila crudigularis,3596059
Arborophila rubrirostris, Arborophila rubrirostris,3596058
Tropicoperdix chloropus, Tropicoperdix chloropus,3596057
Arborophila davidi, Arborophila davidi,3596056
Arborophila cambodiana, Arborophila cambodiana,3596055
Arborophila orientalis, Arborophila orientalis,3596054
Arborophila hyperythra, Arborophila hyperythra,3596053
Arborophila sumatrana, Arborophila sumatrana,3596052
Arborophila atrogularis, Arborophila atrogularis,3596051
Tropicoperdix charltonii, Tropicoperdix charltonii,3596050
Arborophila rolli, Arborophila rolli,3596049
Arborophila brunneopectus, Arborophila brunneopectus,3596048
Coturnix coromandelica, Coturnix coromandelica,3596047
Synoicus adansonii, Synoicus adansonii,3596045
Pternistis ahantensis, Pternistis ahantensis,3596042
Megapodius geelvinkianus, Megapodius geelvinkianus,3596033
Megapodius nicobariensis, Megapodius nicobariensis,3596032
Megapodius bernsteinii, Megapodius bernsteinii,3596031
Megapodius laperouse, Megapodius laperouse,3596029
Talegalla jobiensis, Talegalla jobiensis,3596028
Talegalla cuvieri, Talegalla cuvieri,3596027
Aepypodius bruijnii, Aepypodius bruijnii,3596026
Pauxi koepckeae, Pauxi koepckeae,3596024
Penelope perspicax, Penelope perspicax,3596023
Penelope jacucaca, Penelope jacucaca,3596022
Penelope ortoni, Penelope ortoni,3596021
Penelope dabbenei, Penelope dabbenei,3596020
Agelastes niger, Agelastes niger,3596015
Dactylortyx thoracicus, Dactylortyx thoracicus,3596014
Philortyx fasciatus, Philortyx fasciatus,3596012
Dendrortyx barbatus, Dendrortyx barbatus,3596011
Dendrortyx macroura, Dendrortyx macroura,3596009
Dendrortyx leucophrys, Dendrortyx leucophrys,3596007
Rhynchortyx cinctus, Rhynchortyx cinctus,3596005
Colinus nigrogularis, Colinus nigrogularis,3596004
Cyrtonyx ocellatus, Cyrtonyx ocellatus,3596002
Odontophorus erythrops, Odontophorus erythrops,3596001
Odontophorus dialeucos, Odontophorus dialeucos,3596000
Odontophorus stellatus, Odontophorus stellatus,3595999
Odontophorus strophium, Odontophorus strophium,3595998
Odontophorus hyperythrus, Odontophorus hyperythrus,3595997
Odontophorus melanonotus, Odontophorus melanonotus,3595996
Odontophorus atrifrons, Odontophorus atrifrons,3595995
Odontophorus columbianus, Odontophorus columbianus,3595994
Odontophorus guttatus, Odontophorus guttatus,3595992
Odontophorus balliviani, Odontophorus balliviani,3595991
Odontophorus melanotis, Odontophorus melanotis,3595990
Salvadorina waigiuensis, Salvadorina waigiuensis,3595964
Rhodonessa caryophyllacea, Rhodonessa caryophyllacea,3595948
Alopochen kervazoi, Alopochen kervazoi,3595947
Mergus octosetaceus, Mergus octosetaceus,3595919
Mergus australis, Mergus australis,3595918
Anser serrirostris, Anser serrirostris,3595909
Anas theodori, Anas theodori,3595907
Anas albogularis, Anas albogularis,3595906
Anas eatoni, Anas eatoni,3595905
Tadorna cristata, Tadorna cristata,3595902
Aythya innotata, Aythya innotata,3595901
Aythya baeri, Aythya baeri,3595900
Aythya novaeseelandiae, Aythya novaeseelandiae,3595899
Chenonetta finschi, Chenonetta finschi,3595898
Rhaphidura sabini, Rhaphidura sabini,3595888
Telacanthura ussheri, Telacanthura ussheri,3595887
Telacanthura melanopygia, Telacanthura melanopygia,3595884
Panyptila sanctihieronymi, Panyptila sanctihieronymi,3595882
Panyptila cayennensis, Panyptila cayennensis,3595880
Rhaphidura leucopygialis, Rhaphidura leucopygialis,3595879
Mearnsia picina, Mearnsia picina,3595878
Zoonavena thomensis, Zoonavena thomensis,3595877
Zoonavena grandidieri, Zoonavena grandidieri,3595876
Schoutedenapus myoptilus, Schoutedenapus myoptilus,3595875
Zoonavena sylvatica, Zoonavena sylvatica,3595869
Mearnsia novaeguineae, Mearnsia novaeguineae,3595867
Hirundapus giganteus, Hirundapus giganteus,3595864
Hirundapus celebensis, Hirundapus celebensis,3595863
Hirundapus cochinchinensis, Hirundapus cochinchinensis,3595862
Aeronautes montivagus, Aeronautes montivagus,3595861
Tachornis furcata, Tachornis furcata,3595860
Neafrapus boehmi, Neafrapus boehmi,3595859
Apus leuconyx, Apus leuconyx,3595857
Apus salimalii, Apus salimalii,3595856
Apus cooki, Apus cooki,3595853
Chaetura fumosa, Chaetura fumosa,3595851
Chaetura meridionalis, Chaetura andrei meridionalis,3595850
Chaetura egregia, Chaetura egregia,3595849
Chaetura martinica, Chaetura martinica,3595848
Aerodramus ceramensis, Aerodramus ceramensis,3595847
Aerodramus orientalis, Aerodramus orientalis,3595845
Aerodramus pelewensis, Aerodramus pelewensis,3595843
Aerodramus infuscatus, Aerodramus infuscatus,3595842
Aerodramus ocistus, Aerodramus ocistus,3595841
Aerodramus nuditarsus, Aerodramus nuditarsus,3595840
Aerodramus inquietus, Aerodramus inquietus,3595839
Aerodramus sororum, Aerodramus sororum,3595838
Aerodramus leucophaeus, Aerodramus leucophaeus,3595837
Aerodramus unicolor, Aerodramus unicolor,3595836
Aerodramus hirundinaceus, Aerodramus hirundinaceus,3595833
Cypseloides rothschildi, Cypseloides rothschildi,3595810
Cypseloides storeri, Cypseloides storeri,3595809
Cypseloides cherriei, Cypseloides cherriei,3595808
Cypseloides senex, Cypseloides senex,3595807
Cypseloides lemosi, Cypseloides lemosi,3595804
Cypseloides fumigatus, Cypseloides fumigatus,3595803
Streptoprocne biscutata, Streptoprocne biscutata,3595800
Streptoprocne semicollaris, Streptoprocne semicollaris,3595799
Hemiprocne coronata, Hemiprocne coronata,3595797
Tyto nigrobrunnea, Tyto nigrobrunnea,3595796
Tyto sororcula, Tyto sororcula,3595795
Tyto aurantia, Tyto aurantia,3595794
Tyto rosenbergii, Tyto rosenbergii,3595793
Tyto inexspectata, Tyto inexspectata,3595791
Tyto soumagnei, Tyto soumagnei,3595790
Tyto manusi, Tyto manusi,3595788
Phodilus assimilis, Phodilus assimilis,3595785
Scotopelia bouvieri, Scotopelia bouvieri,3595784
Otus grucheti, Mascarenotus grucheti,3595783
Otus sauzieri, Mascarenotus sauzieri,3595782
Scotopelia peli, Scotopelia peli,3595781
Otus murivorus, Mascarenotus murivorus,3595778
Xenoglaux loweryi, Xenoglaux loweryi,3595776
Pyrroglaux podargina, Pyrroglaux podargina,3595774
Jubula lettii, Jubula lettii,3595771
Margarobyas lawrencii, Margarobyas lawrencii,3595769
Sceloglaux albifacies, Sceloglaux albifacies,3595768
Uroglaux dimorpha, Uroglaux dimorpha,3595766
Asio solomonensis, Nesasio solomonensis,3595762
Scotopelia ussheri, Scotopelia ussheri,3595760
Aegolius ridgwayi, Aegolius ridgwayi,3595758
Asio abyssinicus, Asio abyssinicus,3595757
Asio madagascariensis, Asio madagascariensis,3595756
Otus fuliginosus, Otus fuliginosus,3595755
Otus magicus, Otus magicus,3595754
Otus mentawi, Otus mentawi,3595753
Otus rufescens, Otus rufescens,3595752
Otus alius, Otus alius,3595751
Otus everetti, Otus everetti,3595750
Otus nigrorum, Otus nigrorum,3595749
Otus umbra, Otus umbra,3595747
Otus enganensis, Otus enganensis,3595743
Otus angelinae, Otus angelinae,3595742
Otus brookii, Otus brookii,3595741
Otus icterorhynchus, Otus icterorhynchus,3595740
Otus manadensis, Otus manadensis,3595738
Otus mantananensis, Otus mantananensis,3595737
