Frederickena viridis, Frederickena viridis,806151
Buteo trizonatus, Buteo oreophilus trizonatus,805062
Thamnophilus aethiops, Thamnophilus aethiops,804859
Cyanocorax affinis, Cyanocorax affinis,804650
Chenorhamphus grayi, Chenorhamphus grayi,804494
Chenorhamphus campbelli, Chenorhamphus campbelli,804490
Colibri coruscans, Colibri coruscans,804120
Androdon aequatorialis, Androdon aequatorialis,804117
Phaethornis yaruqui, Phaethornis yaruqui,804115
Coturnix japonica, Coturnix japonica,803622
Forpus xanthops, Forpus xanthops,803501
Phylloscopus yunnanensis, Abrornis yunnanensis,803128
Phylloscopus kansuensis, Abrornis kansuensis,803126
Sinosuthora webbiana, Paradoxornis webbianus,802901
Lanius cristatus, Lanius cristatus,802894
Emberiza fucata, Emberiza fucata,802893
Ichthyaetus audouinii, Ichthyaetus audouinii,802818
Anthus correndera, Anthus correndera,802221
Picumnus innominatus, Picumnus innominatus,802075
Streptopelia vinacea, Streptopelia vinacea,801240
Streptopelia tranquebarica, Streptopelia tranquebarica,801238
Streptopelia turtur, Streptopelia turtur,801237
Streptopelia roseogrisea, Streptopelia roseogrisea,801233
Streptopelia semitorquata, Streptopelia semitorquata,801232
Streptopelia picturata, Streptopelia picturata,801227
Reinwardtoena browni, Reinwardtoena browni,801226
Melanerpes erythrocephalus, Melanerpes erythrocephalus,800693
Acrocephalus arundinaceus, Acrocephalus arundinaceus,800677
Campylorhynchus brunneicapillus, Campylorhynchus brunneicapillus,800237
Euryceros prevostii, Euryceros prevostii,799934
Glossoptila goldiei, Psitteuteles goldiei,799913
Eos reticulata, Eos reticulata,799912
Oreopsittacus arfaki, Oreopsittacus arfaki,799909
Apalis kaboboensis, Apalis kaboboensis,799759
Apalis porphyrolaema, Apalis porphyrolaema,799758
Apalis binotata, Apalis binotata,799756
Nesoenas mayeri, Nesoenas mayeri,799324
Tyto novaehollandiae, Tyto novaehollandiae,799262
Tyto longimembris, Tyto longimembris,799259
Eugenes fulgens, Eugenes fulgens,799185
Thamnophilus doliatus, Thamnophilus doliatus,799168
Dendrocolaptes picumnus, Dendrocolaptes picumnus,799164
Formicarius colma, Formicarius colma,799153
Furnarius rufus, Furnarius rufus,799151
Podiceps gallardoi, Podiceps gallardoi,799136
Phrygilus patagonicus, Phrygilus patagonicus,799135
Branta leucopsis, Branta leucopsis,799124
Branta ruficollis, Branta ruficollis,799106
Hypopyrrhus pyrohypogaster, Hypopyrrhus pyrohypogaster,798659
Eurostopodus mystacalis, Eurostopodus mystacalis,798642
Antilophia galeata, Antilophia galeata,798122
Anthoscopus musculus, Anthoscopus musculus,798100
Cinnyris superbus, Cinnyris superbus,797581
Chloropsis hardwickii, Chloropsis hardwickii,797578
Dicaeum anthonyi, Dicaeum anthonyi,797577
Dicaeum agile, Dicaeum agile,797576
Aethopyga primigenia, Aethopyga primigenia,797574
Aethopyga duyvenbodei, Aethopyga duyvenbodei,797573
Anthreptes rectirostris, Anthreptes rectirostris,797572
Aethopyga siparaja, Aethopyga siparaja,797571
Dicaeum celebicum, Dicaeum celebicum,797567
Dicaeum bicolor, Dicaeum bicolor,797566
Pterodroma hypoleuca, Pterodroma hypoleuca,797520
Apus acuticauda, Apus acuticauda,797146
Apus niansae, Apus niansae,797144
Cercomacroides nigrescens, Cercomacra nigrescens,797060
Cercomacroides laeta, Cercomacra laeta,797054
Gyps indicus, Gyps indicus,796905
Micromacronus leytensis, Micromacronus leytensis,796101
Hirundo megaensis, Hirundo megaensis,795248
Hirundo nigrorufa, Hirundo nigrorufa,795245
Porzana porzana, Porzana porzana,795161
Prunella fulvescens, Prunella fulvescens,795160
Prunella himalayana, Prunella himalayana,795159
Prunella rubida, Prunella rubida,795158
Muscicapa griseisticta, Muscicapa griseisticta,795157
Phoenicurus erythronotus, Phoenicurus erythronotus,795156
Pluvialis apricaria, Pluvialis apricaria,795155
Apus melba, Tachymarptis melba,795151
Crotophaga major, Crotophaga major,794915
Tyto capensis, Tyto capensis,794579
Stipiturus malachurus, Stipiturus malachurus,793906
Chlamydera lauterbachi, Chlamydera lauterbachi,793510
Pitta elegans, Pitta elegans,793324
Pitta anerythra, Pitta anerythra,793323
Hydrornis phayrei, Hydrornis phayrei,793320
Lamprotornis ornatus, Lamprotornis ornatus,793168
Lamprotornis mevesii, Lamprotornis mevesii,793167
Lamprotornis hildebrandti, Lamprotornis hildebrandti,793166
Lamprotornis fischeri, Lamprotornis fischeri,793165
Hylopsar purpureiceps, Lamprotornis purpureiceps,793157
Lamprotornis pulcher, Lamprotornis pulcher,793156
Lamprotornis regius, Lamprotornis regius,793151
Ichthyaetus hemprichii, Ichthyaetus hemprichii,792987
Actitis hypoleucos, Actitis hypoleucos,792983
Dendrocopos syriacus, Dendrocopos syriacus,792919
Calocitta formosa, Calocitta formosa,792691
Cuculus canorus, Cuculus canorus,792628
Cacomantis flabelliformis, Cacomantis flabelliformis,792623
Chrysococcyx klaas, Chrysococcyx klaas,792620
Larus argentatus, Larus argentatus,791957
Aythya nyroca, Aythya nyroca,789865
Psittacara leucophthalmus, Psittacara leucophthalmus,789655
Eupsittula cactorum, Eupsittula cactorum,789654
Brotogeris versicolurus, Brotogeris versicolurus,789650
Ara severus, Ara severus,789646
Anodorhynchus leari, Anodorhynchus leari,789645
Diopsittaca nobilis, Diopsittaca nobilis,789639
Lybius melanopterus, Pogonornis melanopterus,789439
Lybius dubius, Pogonornis dubius,789437
Lybius torquatus, Lybius torquatus,789435
Lybius vieilloti, Lybius vieilloti,789433
Buccanodon duchaillui, Buccanodon duchaillui,789428
Pterocles orientalis, Pterocles orientalis,789254
Passerella iliaca, Passerella iliaca,789028
Dasycrotapha speciosa, Stachyris speciosa,788849
Pogonocichla stellata, Pogonocichla stellata,788717
Phoenicurus erythrogastrus, Phoenicurus erythrogastrus,788699
Asthenes luizae, Asthenes luizae,788594
Otus spilocephalus, Otus spilocephalus,788568
Icterus parisorum, Icterus parisorum,788031
Icterus spurius, Icterus spurius,788030
Icterus icterus, Icterus icterus,788029
Icterus leucopteryx, Icterus leucopteryx,788028
Icterus mesomelas, Icterus mesomelas,788027
Icterus nigrogularis, Icterus nigrogularis,788024
Embernagra platensis, Embernagra platensis,787934
Thripadectes ignobilis, Thripadectes ignobilis,787773
Chlamydotis macqueenii, Chlamydotis macqueenii,787600
Ramphocelus nigrogularis, Ramphocelus nigrogularis,787421
Coua cristata, Coua cristata,787074
Coua caerulea, Coua caerulea,787072
Coccyzus melacoryphus, Coccyzus melacoryphus,787069
Coua ruficeps, Coua ruficeps,787066
Coua reynaudii, Coua reynaudii,787064
Coua cursor, Coua cursor,787062
Orthotomus chloronotus, Orthotomus chloronotus,786960
Myadestes elisabeth, Myadestes elisabeth,786483
Myadestes obscurus, Myadestes obscurus,786482
Myadestes occidentalis, Myadestes occidentalis,786479
Aegypius monachus, Aegypius monachus,786449
Caracara plancus, Caracara plancus,786444
Falco columbarius, Falco columbarius,786443
Falco peregrinus, Falco peregrinus,786435
Accipiter gentilis, Accipiter gentilis,786433
Pauxi unicornis, Pauxi unicornis,786422
Mitu salvini, Mitu salvini,786420
Scytalopus novacapitalis, Scytalopus novacapitalis,786354
Scytalopus pachecoi, Scytalopus pachecoi,786306
Somateria mollissima, Somateria mollissima,785961
Buceros rhinoceros, Buceros rhinoceros,785189
Penelopides panini, Penelopides panini,785187
Ceratogymna atrata, Ceratogymna atrata,785184
Buceros bicornis, Buceros bicornis,785181
Tigrisoma fasciatum, Tigrisoma fasciatum,784693
Hydrornis baudii, Hydrornis baudii,784637
Microcerculus bambla, Microcerculus bambla,784615
Henicorhina leucoptera, Henicorhina leucoptera,784613
Eupodotis afraoides, Afrotis afraoides,784565
Hemithraupis guira, Hemithraupis guira,784528
Eudromia formosa, Eudromia formosa,784522
Galbula leucogastra, Galbula leucogastra,784520
Galbula galbula, Galbula galbula,784518
Harpia harpyja, Harpia harpyja,783378
Hypsipetes siquijorensis, Ixos siquijorensis,783277
Pycnonotus flavescens, Pycnonotus flavescens,783276
Pericrocotus roseus, Pericrocotus roseus,781946
Alaudala rufescens, Calandrella rufescens,781908
Eremophila bilopha, Eremophila bilopha,781906
Mirafra javanica, Mirafra javanica,781904
Lullula arborea, Lullula arborea,781902
Spizocorys starki, Eremalauda starki,781897
Buteo lineatus, Buteo lineatus,781301
Rhizothera longirostris, Rhizothera longirostris,781248
Chlorestes notata, Chlorostilbon notatus,781208
Bucephala islandica, Bucephala islandica,780952
Phalacrocorax nigrogularis, Phalacrocorax nigrogularis,780772
Dromococcyx phasianellus, Dromococcyx phasianellus,780440
Cercococcyx montanus, Cercococcyx montanus,780426
Terpsiphone bourbonnensis, Terpsiphone bourbonnensis,780374
Terpsiphone cyanescens, Terpsiphone cyanescens,780370
Malacopteron affine, Malacopteron affine,779250
Dacnis venusta, Dacnis venusta,779207
Coryphospingus pileatus, Coryphospingus pileatus,779206
Pycnonotus jocosus, Pycnonotus jocosus,778857
Pycnonotus finlaysoni, Pycnonotus finlaysoni,778856
Brachypodius melanocephalos, Brachypodius atriceps,778855
Phyllastrephus albigularis, Phyllastrephus albigularis,778854
Granatina granatina, Uraeginthus granatina,778440
Estrilda paludicola, Estrilda paludicola,778438
Pytilia afra, Pytilia afra,778436
Hypargos margaritatus, Hypargos margaritatus,778434
Pytilia phoenicoptera, Pytilia phoenicoptera,778432
Pytilia lineata, Pytilia lineata,778430
Granatina ianthinogaster, Uraeginthus ianthinogaster,778426
Euschistospiza dybowskii, Euschistospiza dybowskii,778423
Columba junoniae, Columba junoniae,777973
Troglodytes sissonii, Thryomanes sissonii,777935
Cinnyris regius, Cinnyris regius,776938
Cinnyris rufipennis, Nectarinia rufipennis,776936
Cinnyris afer, Cinnyris afer,776926
Cinnyris chalybeus, Cinnyris chalybeus,776924
Cinnyris chloropygius, Cinnyris chloropygius,776922
Amblyornis subalaris, Amblyornis subalaris,776475
Pica pica, Pica pica,776471
Ailuroedus crassirostris, Ailuroedus crassirostris,776470
Scenopoeetes dentirostris, Scenopoeetes dentirostris,776465
Euscarthmus rufomarginatus, Euscarthmus rufomarginatus,775801
Corythopis torquatus, Corythopis torquatus,775797
Corapipo gutturalis, Corapipo gutturalis,775796
Sialia sialis, Sialia sialis,775715
Ixoreus naevius, Ixoreus naevius,775708
Falco dickinsoni, Falco dickinsoni,775464
Tchagra minutus, Tchagra minuta,775144
Pyrilia pyrilia, Pyrilia pyrilia,773835
Patagioenas maculosa, Patagioenas maculosa,773522
Patagioenas leucocephala, Patagioenas leucocephala,773513
Patagioenas speciosa, Patagioenas speciosa,773509
Patagioenas squamosa, Patagioenas squamosa,773506
Patagioenas picazuro, Patagioenas picazuro,773505
Tauraco leucotis, Tauraco leucotis,772749
Tauraco leucolophus, Tauraco leucolophus,772747
Tauraco fischeri, Tauraco fischeri,772745
Tauraco corythaix, Tauraco corythaix,772743
Musophaga rossae, Musophaga rossae,772741
Tauraco schalowi, Tauraco schalowi,772729
Tauraco macrorhynchus, Tauraco macrorhynchus,772727
Batis crypta, Batis crypta,772295
Cyanocompsa parellina, Cyanocompsa parellina,772205
Sporophila castaneiventris, Sporophila castaneiventris,772201
Sporophila americana, Sporophila americana,772198
Francolinus pintadeanus, Francolinus pintadeanus,772143
Platycercus adscitus, Platycercus adscitus,771955
Prioniturus luconensis, Prioniturus luconensis,771954
Vini solitarius, Phigys solitarius,771947
Lorius albidinucha, Lorius albidinucha,771942
Neopsittacus musschenbroekii, Neopsittacus musschenbroekii,771941
Xenopipo uniformis, Xenopipo uniformis,771685
Uromyias agraphia, Anairetes agraphia,771605
Coturnix novaezelandiae, Coturnix novaezelandiae,771603
Anas andium, Anas flavirostris andium,770733
Pteroglossus pluricinctus, Pteroglossus pluricinctus,769998
Cinnyris comorensis, Cinnyris comorensis,769101
Serilophus lunatus, Serilophus lunatus,768994
Rhipidura rufiventris, Rhipidura rufiventris,768649
Rhipidura rufidorsa, Rhipidura rufidorsa,768648
Rhipidura hyperythra, Rhipidura hyperythra,768645
Rhipidura threnothorax, Rhipidura threnothorax,768640
Calidris acuminata, Calidris acuminata,768489
Accipiter brevipes, Accipiter brevipes,767922
Accipiter erythropus, Accipiter erythropus,767919
Accipiter francesiae, Accipiter francesiae,767916
Accipiter henstii, Accipiter henstii,767915
Accipiter melanochlamys, Accipiter melanochlamys,767914
Accipiter imitator, Accipiter imitator,767913
Chaetura cinereiventris, Chaetura cinereiventris,767836
Branta sandvicensis, Branta sandvicensis,767835
Anser rossii, Anser rossii,767830
Anhima cornuta, Anhima cornuta,767829
Otus gurneyi, Mimizuku gurneyi,767828
Gampsonyx swainsonii, Gampsonyx swainsonii,767826
Ninox philippensis, Ninox philippensis,767823
Buthraupis montana, Buthraupis montana,767689
Columba guinea, Columba guinea,767317
Leptotila jamaicensis, Leptotila jamaicensis,767308
Kleinothraupis parodii, Hemispingus parodii,767282
Gerygone tenebrosa, Gerygone tenebrosa,767231
Yuhina gularis, Yuhina gularis,767083
Zosterornis whiteheadi, Stachyris whiteheadi,767078
Terpsiphone viridis, Terpsiphone viridis,767075
Lesbia victoriae, Lesbia victoriae,767074
Chrysuronia coeruleogularis, Lepidopyga coeruleogularis,767072
Lophornis delattrei, Lophornis delattrei,767071
Heliomaster longirostris, Heliomaster longirostris,767068
Klais guimeti, Klais guimeti,767066
Myrtis fanny, Myrtis fanny,767065
Larus crassirostris, Larus crassirostris,766942
Circus buffoni, Circus buffoni,766824
Circus assimilis, Circus assimilis,766823
Circus approximans, Circus approximans,766820
Circus macrourus, Circus macrourus,766813
Circus pygargus, Circus pygargus,766811
Gallirallus okinawae, Gallirallus okinawae,765969
Rallina eurizonoides, Rallina eurizonoides,765966
Meliphaga aruensis, Meliphaga aruensis,765834
Microptilotis orientalis, Meliphaga orientalis,765833
Microptilotis montanus, Meliphaga montana,765825
Pooecetes gramineus, Pooecetes gramineus,765407
Calcarius ornatus, Calcarius ornatus,765406
Junco phaeonotus, Junco phaeonotus,765405
Aix galericulata, Aix galericulata,765197
Aix sponsa, Aix sponsa,765195
Anas capensis, Anas capensis,765188
Mareca penelope, Mareca penelope,765180
Anas platyrhynchos, Anas platyrhynchos,765167
Accipiter cooperii, Accipiter cooperii,764598
Aulacorhynchus derbianus, Aulacorhynchus derbianus,764291
Paradisaea minor, Paradisaea minor,762101
Parotia lawesii, Parotia lawesii,762097
Paradisaea rubra, Paradisaea rubra,762087
Synallaxis courseni, Synallaxis courseni,762050
Synallaxis gujanensis, Synallaxis gujanensis,762048
Euphonia fulvicrissa, Euphonia fulvicrissa,761503
Pyrilia vulturina, Pyrilia vulturina,761489
Pycnonotus xanthopygos, Pycnonotus xanthopygos,761328
Crithagra scotops, Serinus scotops,760388
Saxicola ferreus, Saxicola ferreus,760327
Arremon virenticeps, Buarremon virenticeps,759621
Sylvietta virens, Sylvietta virens,759577
Schistolais leucopogon, Schistolais leucopogon,759573
Schistolais leontica, Schistolais leontica,759570
Apalis flavida, Apalis flavida,759568
Prinia subflava, Prinia subflava,759556
Geositta rufipennis, Geositta rufipennis,759514
Frederickena unduliger, Frederickena unduligera,759513
Leptasthenura pileata, Leptasthenura pileata,759512
Xenops rutilans, Xenops rutilans,759511
Berlepschia rikeri, Berlepschia rikeri,759508
Phacellodomus ruber, Phacellodomus ruber,759506
Apus pacificus, Apus pacificus,759417
Leiothlypis virginiae, Oreothlypis virginiae,759416
Archilochus colubris, Archilochus colubris,759410
Automolus leucophthalmus, Automolus leucophthalmus,759407
Falco rusticolus, Falco rusticolus,759238
Zosterops vellalavella, Zosterops vellalavella,758766
Zosterops splendidus, Zosterops splendidus,758765
Zosterops stresemanni, Zosterops stresemanni,758764
Zosterops luteus, Zosterops luteus,758762
Zosterops metcalfii, Zosterops metcalfii,758761
Zosterops murphyi, Zosterops murphyi,758760
Zosterops mysorensis, Zosterops rendovae,758759
Crypturellus tataupa, Crypturellus tataupa,758347
Ara militaris, Ara militaris,758345
Aechmophorus occidentalis, Aechmophorus occidentalis,758343
Conirostrum bicolor, Conirostrum bicolor,757871
Mniotilta varia, Mniotilta varia,757859
Clytoceyx rex, Clytoceyx rex,757735
Melidora macrorrhina, Melidora macrorrhina,757734
Dacelo leachii, Dacelo leachii,757732
Pionus tumultuosus, Pionus tumultuosus,757510
Pionus sordidus, Pionus sordidus,757509
Philemon corniculatus, Philemon corniculatus,757331
Pardalotus striatus, Pardalotus striatus,757323
Calyptophilus tertius, Calyptophilus tertius,756923
Merops apiaster, Merops apiaster,755107
Campethera nivosa, Campethera nivosa,755098
Turdus boulboul, Turdus boulboul,754978
Turdus torquatus, Turdus torquatus,754977
Otocichla mupinensis, Turdus mupinensis,754976
Turdus rubrocanus, Turdus rubrocanus,754975
Lalage leucomela, Lalage leucomela,754854
Hylophilus poicilotis, Hylophilus poicilotis,754852
Grallina cyanoleuca, Grallina cyanoleuca,754846
Corvus cryptoleucus, Corvus cryptoleucus,754774
Clytolaema rubricauda, Clytolaema rubricauda,754714
Compsothraupis loricata, Compsothraupis loricata,754709
Conopophaga melanops, Conopophaga melanops,754707
Conopophaga roberti, Conopophaga roberti,754705
Dendragapus fuliginosus, Dendragapus fuliginosus,754431
Tolmomyias poliocephalus, Tolmomyias poliocephalus,753802
Lophotriccus vitiosus, Lophotriccus vitiosus,753799
Tolmomyias assimilis, Tolmomyias assimilis,753798
Ramphotrigon ruficauda, Ramphotrigon ruficauda,753797
Platyrinchus platyrhynchos, Platyrinchus platyrhynchos,753796
Ramphotrigon megacephalum, Ramphotrigon megacephalum,753791
Psittacula alexandri, Psittacula alexandri,753626
Dicrurus modestus, Dicrurus modestus,753449
Baeopogon clamans, Baeopogon clamans,753180
Phyllastrephus terrestris, Phyllastrephus terrestris,753179
Phyllastrephus hypochloris, Phyllastrephus hypochloris,753178
Uropsalis segmentata, Uropsalis segmentata,752978
Strix woodfordii, Strix woodfordii,752976
Macrocephalon maleo, Macrocephalon maleo,750781
Eulipoa wallacei, Eulipoa wallacei,750774
Megapodius tenimberensis, Megapodius tenimberensis,750772
Hylophilus pectoralis, Hylophilus pectoralis,750155
Micrastur mintoni, Micrastur mintoni,749748
Micrastur mirandollei, Micrastur mirandollei,749743
Melampitta gigantea, Melampitta gigantea,749725
Colluricincla megarhyncha, Colluricincla megarhyncha,749724
Pitohui dichrous, Pitohui dichrous,749722
Sporopipes frontalis, Sporopipes frontalis,749642
Ploceus ocularis, Ploceus ocularis,749635
Gymnoris dentata, Gymnoris dentata,749634
Strix davidi, Strix davidi,749477
Hypocharmosyna rubronotata, Charmosyna rubronotata,749206
Nestor notabilis, Nestor notabilis,749203
Vini australis, Vini australis,749201
Hypocharmosyna placentis, Charmosyna placentis,749199
Apteryx mantelli, Apteryx australis mantelli,748998
Carpodacus rodochroa, Carpodacus rodochroa,747629
Lafresnaya lafresnayi, Lafresnaya lafresnayi,747338
Coeligena coeligena, Coeligena coeligena,747318
Coeligena iris, Coeligena iris,747317
Microeca griseoceps, Microeca griseoceps,746865
Microeca flavigaster, Microeca flavigaster,746863
Melanodryas vittata, Melanodryas vittata,746862
Eopsaltria griseogularis, Eopsaltria griseogularis,746860
Eopsaltria georgiana, Eopsaltria georgiana,746859
Peneothello cyanus, Peneothello cyanus,746856
Eopsaltria pulverulenta, Peneothello pulverulenta,746854
Dicaeum nigrilore, Dicaeum nigrilore,746749
Dicaeum monticolum, Dicaeum monticolum,746748
Dicaeum ignipectus, Dicaeum ignipectus,746745
Dicaeum tristrami, Dicaeum tristrami,746743
Dicaeum sanguinolentum, Dicaeum sanguinolentum,746742
Dicaeum pygmaeum, Dicaeum pygmaeum,746741
Arborophila gingica, Arborophila gingica,746380
Cephalopterus glabricollis, Cephalopterus glabricollis,746246
Conopias albovittatus, Conopias albovittatus,746231
Remiz pendulinus, Remiz pendulinus,746137
Periparus ater, Periparus ater,746130
Cyanistes caeruleus, Cyanistes caeruleus,746120
Schoeniophylax phryganophilus, Schoeniophylax phryganophilus,745716
Synallaxis scutata, Synallaxis scutata,745714
Passer domesticus, Passer domesticus,745175
Pyrrhura cruentata, Pyrrhura cruentata,744928
Pyrrhura rupicola, Pyrrhura rupicola,744927
Dendrocopos leucopterus, Dendrocopos leucopterus,744792
Cecropis semirufa, Cecropis semirufa,744787
Campylorhynchus nuchalis, Campylorhynchus nuchalis,744785
Sphyrapicus varius, Sphyrapicus varius,744570
Urile pelagicus, Urile pelagicus,744568
Urile urile, Urile urile,744567
Ardea herodias, Ardea herodias,744564
Egretta rufescens, Egretta rufescens,744560
Laniarius willardi, Laniarius willardi,744298
Pygarrhichas albogularis, Pygarrhichas albogularis,743737
Pyriglena leuconota, Pyriglena leuconota,743735
Cercomacra melanaria, Cercomacra melanaria,743733
Chamaeza meruloides, Chamaeza meruloides,743731
Sclerurus scansor, Sclerurus scansor,743729
Quiscalus mexicanus, Quiscalus mexicanus,743411
Caprimulgus rufigena, Caprimulgus rufigena,742978
Caprimulgus poliocephalus, Caprimulgus poliocephalus,742970
Antrostomus ridgwayi, Antrostomus ridgwayi,742961
Stercorarius longicaudus, Stercorarius longicaudus,742641
Stercorarius parasiticus, Stercorarius parasiticus,742640
Stercorarius chilensis, Stercorarius chilensis,742638
Stercorarius skua, Stercorarius skua,742633
Todus mexicanus, Todus mexicanus,741575
Stactolaema olivacea, Stactolaema olivacea,741573
Chordeiles nacunda, Podager nacunda,741570
Cyanocorax violaceus, Cyanocorax violaceus,740606
Cyanocorax sanblasianus, Cyanocorax sanblasianus,740603
Cyanocorax heilprini, Cyanocorax heilprini,740600
Cyanocorax cyanopogon, Cyanocorax cyanopogon,740597
Cyanocorax cristatellus, Cyanocorax cristatellus,740594
Cyanocorax caeruleus, Cyanocorax caeruleus,740591
Cyanocorax beecheii, Cyanocorax beecheii,740587
Tigrisoma lineatum, Tigrisoma lineatum,740211
Podiceps grisegena, Podiceps grisegena,740071
Caloramphus fuliginosus, Calorhamphus fuliginosus,738747
Chrysophlegma mentale, Chrysophlegma mentale,738744
Psilopogon haemacephalus, Megalaima haemacephala,738739
Psilopogon oorti, Megalaima oorti,738735
Gymnobucco calvus, Gymnobucco calvus,738733
Chionis minor, Chionis minor,738515
Rynchops niger, Rynchops niger,738512
Sterna hirundinacea, Sterna hirundinacea,738509
Platalea minor, Platalea minor,738327
Dendrocygna guttata, Dendrocygna guttata,737607
Dendrocygna javanica, Dendrocygna javanica,737604
Psittacara euops, Psittacara euops,737545
Certhia nipalensis, Certhia nipalensis,737469
Sylvietta rufescens, Sylvietta rufescens,737232
Lonchura pallida, Lonchura pallida,737144
Scotocerca inquieta, Scotocerca inquieta,736633
Myrmothera campanisona, Myrmothera campanisona,736630
Acanthiza ewingii, Acanthiza ewingii,736622
Acanthiza apicalis, Acanthiza apicalis,736620
Acanthiza iredalei, Acanthiza iredalei,736612
Acanthiza inornata, Acanthiza inornata,736610
Sholicola albiventris, Brachypteryx albiventris,736235
Aegolius funereus, Aegolius funereus,735586
Quiscalus nicaraguensis, Quiscalus nicaraguensis,735244
Quiscalus palustris, Quiscalus palustris,735243
Centropus senegalensis, Centropus senegalensis,734886
Melopsittacus undulatus, Melopsittacus undulatus,734818
Ploceus galbula, Ploceus galbula,734780
Colaptes auratus, Colaptes auratus,733990
Dryobates villosus, Picoides villosus,733988
Dryocopus pileatus, Dryocopus pileatus,733984
Xiphocolaptes falcirostris, Xiphocolaptes falcirostris,733326
Xenerpestes minlosi, Xenerpestes minlosi,733324
Thripophaga cherriei, Thripophaga cherriei,733322
Catriscus brevirostris, Schoenicola brevirostris,732986
Myiarchus tuberculifer, Myiarchus tuberculifer,730978
Tyrannus caudifasciatus, Tyrannus caudifasciatus,730977
Rhytipterna immunda, Rhytipterna immunda,730976
Lepidocolaptes squamatus, Lepidocolaptes squamatus,729982
Lepidocolaptes lacrymiger, Lepidocolaptes lacrymiger,729980
Lepidocolaptes souleyetii, Lepidocolaptes souleyetii,729979
Lepidocolaptes angustirostris, Lepidocolaptes angustirostris,729977
Sittasomus griseicapillus, Sittasomus griseicapillus,729975
Lepidocolaptes albolineatus, Lepidocolaptes albolineatus,729973
Anthus pallidiventris, Anthus pallidiventris,729806
Botaurus lentiginosus, Botaurus lentiginosus,729491
Bubulcus ibis, Bubulcus ibis,729476
Malacopteron palawanense, Malacopteron palawanense,728857
Malacopteron magnum, Malacopteron magnum,728854
Cisticola marginatus, Cisticola marginatus,728427
Falco longipennis, Falco longipennis,728397
Phalcoboenus megalopterus, Phalcoboenus megalopterus,728383
Callipepla squamata, Callipepla squamata,728092
Bonasa umbellus, Bonasa umbellus,728082
Centrocercus urophasianus, Centrocercus urophasianus,728077
Tympanuchus cupido, Tympanuchus cupido,728073
Cyornis unicolor, Cyornis unicolor,727917
Cyornis poliogenys, Cyornis poliogenys,727915
Cercotrichas galactotes, Cercotrichas galactotes,727908
Cercotrichas barbata, Cercotrichas barbata,727906
Cossypha heuglini, Cossypha heuglini,727901
Cercotrichas quadrivirgata, Cercotrichas quadrivirgata,727897
Cossypha humeralis, Cossypha humeralis,727893
Agriornis murinus, Agriornis murinus,727889
Indicator indicator, Indicator indicator,727823
Indicator meliphilus, Indicator meliphilus,727821
Graueria vittata, Graueria vittata,727818
Gymnobucco sladeni, Gymnobucco sladeni,727815
Glaucidium albertinum, Glaucidium albertinum,727810
Lagonosticta rara, Lagonosticta rara,727662
Lagonosticta larvata, Lagonosticta larvata,727660
Lagonosticta rubricata, Lagonosticta rubricata,727658
Lagonosticta rhodopareia, Lagonosticta rhodopareia,727656
Lagonosticta virata, Lagonosticta virata,727654
Rheinardia ocellata, Rheinardia ocellata,727334
Loxigilla noctis, Loxigilla noctis,726784
Meiglyptes tristis, Meiglyptes tristis,726782
Phylloscopus trochiloides, Phylloscopus trochiloides,726314
Sylvia atricapilla, Sylvia atricapilla,726312
Acrocephalus scirpaceus, Acrocephalus scirpaceus,726310
Phylloscopus collybita, Phylloscopus collybita,726307
Phylloscopus humei, Abrornis humei,726306
Phylloscopus nitidus, Phylloscopus nitidus,726303
Phylloscopus sibilatrix, Phylloscopus sibilatrix,726302
Ardenna grisea, Ardenna grisea,726166
Ardenna gravis, Ardenna gravis,726165
Podiceps auritus, Podiceps auritus,726164
Daption capense, Daption capense,726152
Lyrurus tetrix, Lyrurus tetrix,725154
Merops breweri, Merops breweri,724987
