Cinclodes pabsti, Cinclodes pabsti,403346
Cyphorhinus phaeocephalus, Cyphorhinus phaeocephalus,403167
Troglodytes solstitialis, Troglodytes solstitialis,402977
Troglodytes rufociliatus, Troglodytes rufociliatus,402975
Troglodytes rufulus, Troglodytes rufulus,402974
Thryorchilus browni, Thryorchilus browni,402973
Henicorhina leucosticta, Henicorhina leucosticta,402970
Tinamus major, Tinamus major,402466
Casuarius bennetti, Casuarius bennetti,402459
Bubo bubo, Bubo bubo,402453
Nothoprocta perdicaria, Nothoprocta perdicaria,402446
Leucocarbo bransfieldensis, Leucocarbo bransfieldensis,401967
Trochalopteron variegatum, Trochalopteron variegatum,401611
Ianthocincla ocellata, Garrulax ocellatus,401603
Trochalopteron squamatum, Garrulax squamatus,401600
Haematortyx sanguiniceps, Haematortyx sanguiniceps,401527
Entomodestes coracinus, Entomodestes coracinus,401039
Cochoa viridis, Cochoa viridis,401023
Neocichla gutturalis, Neocichla gutturalis,401019
Lanioturdus torquatus, Lanioturdus torquatus,400829
Graydidascalus brachyurus, Graydidascalus brachyurus,400211
Alipiopsitta xanthops, Alipiopsitta xanthops,400207
Amazona vinacea, Amazona vinacea,400205
Amazona tucumana, Amazona tucumana,400203
Amazona rhodocorytha, Amazona rhodocorytha,400201
Amazona pretrei, Amazona pretrei,400199
Rostrhamus sociabilis, Rostrhamus sociabilis,399794
Sarothrura elegans, Sarothrura elegans,399792
Spheniscus mendiculus, Spheniscus mendiculus,399791
Crithagra totta, Serinus totta,399227
Serinus syriacus, Serinus syriacus,399225
Rhodopis vesper, Rhodopis vesper,398914
Selasphorus flammula, Selasphorus flammula,398913
Polytmus theresiae, Polytmus theresiae,398912
Urochroa bougueri, Urochroa bougueri,398910
Heliodoxa schreibersii, Heliodoxa schreibersii,398909
Ramphastos brevis, Ramphastos brevis,397816
Corvus woodfordi, Corvus woodfordi,397154
Idiopsar dorsalis, Phrygilus dorsalis,396696
Geospizopsis plebejus, Phrygilus plebejus,396695
Paroaria capitata, Paroaria capitata,396694
Phrygilus atriceps, Phrygilus atriceps,396691
Saltator atripennis, Saltator atripennis,396690
Saltator aurantiirostris, Saltator aurantiirostris,396689
Ramphocelus dimidiatus, Ramphocelus dimidiatus,396688
Saltator atriceps, Saltator atriceps,396686
Saltator grossus, Saltator grossus,396685
Saltator maximus, Saltator maximus,396683
Pseudeos fuscata, Pseudeos fuscata,396440
Myiarchus nuttingi, Myiarchus nuttingi,396005
Cymbirhynchus macrorhynchos, Cymbirhynchus macrorhynchos,395865
Sapayoa aenigma, Sapayoa aenigma,395861
Symposiachrus barbatus, Symposiachrus barbatus,395308
Strix nebulosa, Strix nebulosa,395196
Strix leptogrammica, Strix leptogrammica,395194
Pulsatrix koeniswaldiana, Pulsatrix koeniswaldiana,395192
Cymbilaimus lineatus, Cymbilaimus lineatus,394156
Thamnophilus melanothorax, Thamnophilus melanothorax,394154
Sakesphorus luctuosus, Sakesphorus luctuosus,394152
Thamnophilus melanonotus, Thamnophilus melanonotus,394151
Rhodospingus cruentus, Rhodospingus cruentus,393978
Purpureicephalus spurius, Purpureicephalus spurius,393109
Nigrita bicolor, Nigrita bicolor,393094
Cryptospiza shelleyi, Cryptospiza shelleyi,393092
Amadina fasciata, Amadina fasciata,393090
Amandava amandava, Amandava amandava,393085
Amadina erythrocephala, Amadina erythrocephala,393083
Ocyphaps lophotes, Ocyphaps lophotes,392967
Gallicolumba tristigmata, Gallicolumba tristigmata,392935
Geotrygon versicolor, Geotrygon versicolor,392934
Goura victoria, Goura victoria,392933
Vireo atricapilla, Vireo atricapilla,392755
Leiothlypis ruficapilla, Oreothlypis ruficapilla,392341
Harpactes ardens, Harpactes ardens,392094
Harpactes diardii, Harpactes diardii,392091
Apaloderma narina, Apaloderma narina,392077
Eriocnemis luciani, Eriocnemis luciani,391053
Lonchura kelaarti, Lonchura kelaarti,389883
Chloropsis sonnerati, Chloropsis sonnerati,388836
Cinnyris cupreus, Cinnyris cupreus,388833
Chaetops aurantius, Chaetops aurantius,388832
Zosterops poliogastrus, Zosterops poliogastrus,388826
Lepidothrix coeruleocapilla, Lepidothrix coeruleocapilla,388714
Dives dives, Dives dives,388540
Columbina talpacoti, Columbina talpacoti,388536
Euphonia affinis, Euphonia affinis,388533
Parus minor, Parus minor,387300
Tachyeres pteneres, Tachyeres pteneres,386305
Fratercula cirrhata, Fratercula cirrhata,385981
Aerodramus brevirostris, Aerodramus brevirostris,385669
Melanopareia elegans, Melanopareia elegans,385503
Mitu mitu, Mitu mitu,385229
Gallinula nesiotis, Gallinula nesiotis,385131
Gallinula comeri, Gallinula nesiotis comeri,385129
Basileuterus melanogenys, Basileuterus melanogenys,384916
Myiothlypis chrysogaster, Basileuterus chrysogaster,384910
Basileuterus trifasciatus, Basileuterus trifasciatus,384908
Myiothlypis fraseri, Myiothlypis fraseri,384906
Myiothlypis conspicillata, Myiothlypis conspicillata,384904
Pseudasthenes cactorum, Asthenes cactorum,384629
Geothlypis formosa, Geothlypis formosa,384466
Troglodytes hiemalis, Troglodytes hiemalis,384301
Uropsila leucogastra, Uropsila leucogastra,384290
Galbula albirostris, Galbula albirostris,383931
Dromas ardeola, Dromas ardeola,383929
Himantornis haematopus, Himantornis haematopus,383918
Lophoceros camurus, Tockus camurus,383917
Cacicus haemorrhous, Cacicus haemorrhous,383912
Cacicus chrysonotus, Cacicus chrysonotus,383909
Cacicus chrysopterus, Cacicus chrysopterus,383908
Phylloscopus umbrovirens, Seicercus umbrovirens,383587
Phylloscopus ruficapilla, Phylloscopus ruficapilla,383585
Acrocephalus paludicola, Acrocephalus paludicola,383152
Acrocephalus melanopogon, Acrocephalus melanopogon,383150
Acrocephalus baeticatus, Acrocephalus baeticatus,383148
Acrocephalus palustris, Acrocephalus palustris,383147
Acrocephalus dumetorum, Acrocephalus dumetorum,383146
Acrocephalus tangorum, Acrocephalus tangorum,383145
Acrocephalus agricola, Acrocephalus agricola,383143
Acrocephalus griseldis, Acrocephalus griseldis,383142
Arundinax aedon, Arundinax aedon,383140
Tickellia hodgsoni, Tickellia hodgsoni,382666
Setophaga angelae, Setophaga angelae,381849
Tyrannus dominicensis, Tyrannus dominicensis,381848
Turdus lherminieri, Cichlherminia lherminieri,381843
Riccordia bicolor, Cyanophaia bicolor,381837
Glaucidium hardyi, Glaucidium hardyi,381785
Glaucidium peruanum, Glaucidium peruanum,381775
Thamnomanes schistogynus, Thamnomanes schistogynus,381762
Myrmotherula sclateri, Myrmotherula sclateri,381760
Myrmotherula klagesi, Myrmotherula klagesi,381754
Myrmotherula grisea, Myrmotherula grisea,381752
Stachyris strialata, Stachyris strialata,381510
Porphyrio martinica, Porphyrio martinica,381387
Spinus xanthogastrus, Spinus xanthogastrus,381385
Turdus amaurochalinus, Turdus amaurochalinus,381318
Turdus falcklandii, Turdus falcklandii,381315
Turdus nigriceps, Turdus nigriceps,381314
Turdus serranus, Turdus serranus,381313
Turdus infuscatus, Turdus infuscatus,381312
Turdus fulviventris, Turdus fulviventris,381311
Turdus maranonicus, Turdus maranonicus,381310
Turdus olivater, Turdus olivater,381309
Turdus reevei, Turdus reevei,381308
Vauriella goodfellowi, Rhinomyias goodfellowi,381197
Porphyrio melanotus, Porphyrio melanotus,380192
Alopecoenas jobiensis, Gallicolumba jobiensis,380071
Ducula rufigaster, Ducula rufigaster,380070
Ploceus heuglini, Ploceus heuglini,380040
Procellaria westlandica, Procellaria westlandica,379429
Elaenia chiriquensis, Elaenia chiriquensis,379424
Turdus leucomelas, Turdus leucomelas,379422
Crypturellus parvirostris, Crypturellus parvirostris,379420
Apus alexandri, Apus alexandri,378822
Caprimulgus climacurus, Caprimulgus climacurus,378509
Eleothreptus candicans, Caprimulgus candicans,378505
Caprimulgus fraenatus, Caprimulgus fraenatus,378498
Hydropsalis maculicaudus, Hydropsalis maculicaudus,378496
Apalis jacksoni, Apalis jacksoni,378489
Sitta pusilla, Sitta pusilla,377450
Yungipicus moluccensis, Dendrocopos moluccensis,377175
Xanthotis flaviventer, Xanthotis flaviventer,376608
Ramsayornis modestus, Ramsayornis modestus,376605
Timeliopsis fulvigula, Timeliopsis fulvigula,376603
Timeliopsis griseigula, Timeliopsis griseigula,376601
Trichodere cockerelli, Trichodere cockerelli,376599
Anthochaera phrygia, Anthochaera phrygia,376597
Geranospiza caerulescens, Geranospiza caerulescens,376409
Sheppardia lowei, Sheppardia lowei,375986
Sheppardia aequatorialis, Sheppardia aequatorialis,375985
Geothlypis rostrata, Geothlypis rostrata,375821
Charmosyna papou, Charmosyna papou,375780
Eclectus roratus, Eclectus roratus,375776
Pitangus sulphuratus, Pitangus sulphuratus,375105
Pyrocephalus rubinus, Pyrocephalus rubinus,375103
Lewinia striata, Gallirallus striatus,374301
Pomatorhinus montanus, Pomatorhinus montanus,374269
Iduna rama, Iduna rama,374225
Terpsiphone batesi, Terpsiphone batesi,374078
Stactolaema anchietae, Stactolaema anchietae,374076
Phylloscopus laurae, Phylloscopus laurae,374073
Copsychus albospecularis, Copsychus albospecularis,373879
Saundersilarus saundersi, Saundersilarus saundersi,373759
Thlypopsis pectoralis, Thlypopsis pectoralis,373417
Merops leschenaulti, Merops leschenaulti,372778
Merops philippinus, Merops philippinus,372777
Coracias garrulus, Coracias garrulus,372551
Atelornis crossleyi, Atelornis crossleyi,372537
Atelornis pittoides, Atelornis pittoides,372536
Brotogeris sanctithomae, Brotogeris sanctithomae,372340
Sheppardia aurantiithorax, Sheppardia aurantiithorax,372336
Burhinus senegalensis, Burhinus senegalensis,371970
Treron sieboldii, Treron sieboldii,371964
Knipolegus orenocensis, Knipolegus orenocensis,371311
Pheucticus ludovicianus, Pheucticus ludovicianus,370813
Peucedramus taeniatus, Peucedramus taeniatus,370807
Ploceus cucullatus, Ploceus cucullatus,370802
Chrysomma sinense, Chrysomma sinense,370024
Coeligena lutetiae, Coeligena lutetiae,369031
Colibri thalassinus, Colibri thalassinus,369029
Emberizoides ypiranganus, Emberizoides ypiranganus,367396
Donacospiza albifrons, Donacospiza albifrons,367394
Drymophila rubricollis, Drymophila rubricollis,367393
Dendrocincla turdina, Dendrocincla turdina,367392
Colorhamphus parvirostris, Colorhamphus parvirostris,367390
Contopus fumigatus, Contopus fumigatus,367389
Emberiza cioides, Emberiza cioides,367092
Onychognathus tenuirostris, Onychognathus tenuirostris,366481
Onychognathus morio, Onychognathus morio,366480
Gracupica nigricollis, Sturnus nigricollis,366471
Sturnus unicolor, Sturnus unicolor,366470
Edolisoma salomonis, Coracina salomonis,366230
Coracina ingens, Coracina ingens,366180
Scytalopus zimmeri, Scytalopus zimmeri,366097
Scytalopus affinis, Scytalopus affinis,366096
Scytalopus griseicollis, Scytalopus griseicollis,366095
Scytalopus argentifrons, Scytalopus argentifrons,366094
Neothraupis fasciata, Neothraupis fasciata,365559
Nemosia pileata, Nemosia pileata,365553
Mitrospingus cassinii, Mitrospingus cassinii,365552
Nephelornis oneilli, Nephelornis oneilli,365544
Stelgidillas gracilirostris, Stelgidillas gracilirostris,364718
Pseudoleistes virescens, Pseudoleistes virescens,364339
Spiza americana, Spiza americana,364334
Xanthocephalus xanthocephalus, Xanthocephalus xanthocephalus,364331
Fraseria ocreata, Fraseria ocreata,364241
Cercotrichas hartlaubi, Cercotrichas hartlaubi,364235
Heinrichia calligyna, Heinrichia calligyna,364228
Irania gutturalis, Irania gutturalis,364210
Himantopus himantopus, Himantopus himantopus,364171
Ciconia ciconia, Ciconia ciconia,363031
Vultur gryphus, Vultur gryphus,363015
Zimmerius acer, Zimmerius acer,362213
Zimmerius bolivianus, Zimmerius bolivianus,362207
Zimmerius gracilipes, Zimmerius gracilipes,362204
Zimmerius viridiflavus, Zimmerius viridiflavus,362201
Zimmerius albigularis, Zimmerius albigularis,362196
Sublegatus obscurior, Sublegatus obscurior,361718
Ploceus insignis, Ploceus insignis,361716
Ploceus angolensis, Ploceus angolensis,361715
Ploceus preussi, Ploceus preussi,361714
Ploceus dorsomaculatus, Ploceus dorsomaculatus,361713
Ceratopipra erythrocephala, Pipra erythrocephala,361712
Serpophaga cinerea, Serpophaga cinerea,361711
Ploceus albinucha, Ploceus albinucha,361710
Serpophaga hypoleuca, Serpophaga hypoleuca,361709
Sublegatus arenarum, Sublegatus arenarum,361708
Premnoplex tatei, Premnoplex tatei,361542
Empidonomus varius, Empidonomus varius,361535
Culicivora caudacuta, Culicivora caudacuta,361533
Casiornis rufus, Casiornis rufus,361531
Attila phoenicurus, Attila phoenicurus,361529
Euscarthmus meloryphus, Euscarthmus meloryphus,361520
Oenanthe melanoleuca, Oenanthe hispanica melanoleuca,360896
Syndactyla roraimae, Automolus roraimae,360809
Syndactyla ruficollis, Syndactyla ruficollis,360807
Thripadectes holostictus, Thripadectes holostictus,360804
Thripadectes melanorhynchus, Thripadectes melanorhynchus,360802
Thripadectes scrutator, Thripadectes scrutator,360800
Campylorhynchus fasciatus, Campylorhynchus fasciatus,360546
Chaetops frenatus, Chaetops frenatus,360543
Fulvetta vinipectus, Alcippe vinipectus,360236
Pteruthius aeralatus, Pteruthius flaviscapis aeralatus,360218
Ptilinopus melanospilus, Ptilinopus melanospilus,359313
Xiphorhynchus fuscus, Xiphorhynchus fuscus,359053
Macropygia phasianella, Macropygia phasianella,358718
Leucosarcia melanoleuca, Leucosarcia melanoleuca,358714
Pseudocolaptes lawrencii, Pseudocolaptes lawrencii,358695
Myiothlypis fulvicauda, Basileuterus fulvicauda,357657
Pachycephala macrorhyncha, Pachycephala macrorhyncha,357408
Microcerculus marginatus, Microcerculus marginatus,356973
Odontorchilus cinereus, Odontorchilus cinereus,356971
Pheugopedius maculipectus, Thryothorus maculipectus,356968
Hylorchilus sumichrasti, Catherpes sumichrasti,356964
Salpinctes obsoletus, Salpinctes obsoletus,356961
Alectoris barbara, Alectoris barbara,356747
Alectoris graeca, Alectoris graeca,356743
Alectoris magna, Alectoris magna,356741
Neopelma chrysocephalum, Neopelma chrysocephalum,356287
Cichlocolaptes leucophrus, Cichlocolaptes leucophrus,356010
Certhiaxis mustelinus, Certhiaxis mustelinus,355999
Cranioleuca gutturata, Cranioleuca gutturata,355994
Cranioleuca hellmayri, Cranioleuca hellmayri,355992
Monarcha castaneiventris, Monarcha castaneiventris,355988
Metabolus rugensis, Metabolus rugensis,355986
Monarcha frater, Monarcha frater,355985
Monarcha melanopsis, Monarcha melanopsis,355984
Symposiachrus guttula, Symposiachrus guttula,355983
Clytorhynchus pachycephaloides, Clytorhynchus pachycephaloides,355982
Mayrornis lessoni, Mayrornis lessoni,355980
Fregilupus varius, Fregilupus varius,355964
Lamprotornis purpureus, Lamprotornis purpureus,355767
Lamprotornis shelleyi, Lamprotornis shelleyi,355759
Horornis flavolivaceus, Horornis flavolivaceus,355464
Horornis vulcanius, Cettia vulcania,355463
Pteroglossus azara, Pteroglossus azara,355345
Pteroglossus frantzii, Pteroglossus frantzii,355169
Phylloscopus schwarzi, Phylloscopus schwarzi,354802
Philemon eichhorni, Philemon eichhorni,354281
Phoenicircus carnifex, Phoenicircus carnifex,354279
Oxylabes madagascariensis, Oxylabes madagascariensis,353520
Orthotomus sutorius, Orthotomus sutorius,353515
Oriolus xanthonotus, Oriolus xanthonotus,353511
Heleia crassirostris, Heleia crassirostris,353135
Dumetia hyperythra, Dumetia hyperythra,353127
Setophaga pinus, Setophaga pinus,352791
Crossoptilon crossoptilon, Crossoptilon crossoptilon,352760
Rollulus rouloul, Rollulus rouloul,352755
Tragopan blythii, Tragopan blythii,352751
Aepypodius arfakianus, Aepypodius arfakianus,352749
Polyplectron napoleonis, Polyplectron napoleonis,352746
Lophura diardi, Lophura diardi,352745
Falco zoniventris, Falco zoniventris,352521
Falco chicquera, Falco chicquera,352520
Falco eleonorae, Falco eleonorae,352519
Falco concolor, Falco concolor,352518
Falco amurensis, Falco amurensis,352517
Hylocitrea bonensis, Hylocitrea bonensis,352344
Coracornis raveni, Coracornis raveni,352341
Lalage leucopyga, Lalage leucopyga,352337
Lalage leucopygialis, Lalage leucopygialis,352336
Pyrrhula leucogenis, Pyrrhula leucogenis,351898
Charadrius marginatus, Charadrius marginatus,349797
Phonipara canora, Tiaris canora,349675
Sporophila nigricollis, Sporophila nigricollis,349673
Melanospiza richardsoni, Melanospiza richardsoni,349672
Sporophila angolensis, Sporophila angolensis,349670
Mimus graysoni, Mimodes graysoni,349284
Gubernetes yetapa, Gubernetes yetapa,348853
Furnarius cristatus, Furnarius cristatus,348850
Dendrocopos major, Dendrocopos major,348848
Corvus crassirostris, Corvus crassirostris,348668
Corvus rhipidurus, Corvus rhipidurus,348023
Urosphena whiteheadi, Urosphena whiteheadi,346549
Tesia superciliaris, Tesia superciliaris,346546
Tesia everetti, Tesia everetti,346544
Tesia cyaniventer, Tesia cyaniventer,346542
Rhipidura cockerelli, Rhipidura cockerelli,346155
Rhipidura fuliginosa, Rhipidura fuliginosa,346153
Myiagra inquieta, Myiagra inquieta,346152
Myiagra rubecula, Myiagra rubecula,346151
Myiagra ferrocyanea, Myiagra ferrocyanea,346150
Myiagra hebetior, Myiagra hebetior,346149
Pachycephala melanura, Pachycephala melanura,346148
Pachycephala rufiventris, Pachycephala rufiventris,346147
Myzomela cineracea, Myzomela cineracea,346146
Myzomela lafargei, Myzomela lafargei,346145
Turdus mandarinus, Turdus mandarinus,345059
Cyanoramphus unicolor, Cyanoramphus unicolor,344229
Agelastes meleagrides, Agelastes meleagrides,342271
Calidris tenuirostris, Calidris tenuirostris,341981
Charadrius mongolus, Charadrius mongolus,341980
Numenius madagascariensis, Numenius madagascariensis,341976
Tringa glareola, Tringa glareola,341975
Mycerobas carnipes, Mycerobas carnipes,341476
Eophona personata, Eophona personata,341474
Pinicola enucleator, Pinicola enucleator,341471
Carpodacus sipahi, Haematospiza sipahi,341467
Eophona migratoria, Eophona migratoria,341465
Puffinus bryani, Puffinus bryani,341459
Monticola sharpei, Monticola sharpei,341214
Larosterna inca, Larosterna inca,341047
Phaetusa simplex, Phaetusa simplex,341044
Chlidonias albostriatus, Sterna albostriata,341038
Thalasseus bengalensis, Sterna bengalensis,341036
Thalasseus bergii, Thalasseus bergii,341034
Thalasseus elegans, Sterna elegans,341032
Sterna forsteri, Sterna forsteri,341030
Callipepla gambelii, Callipepla gambelii,340887
Callipepla douglasii, Callipepla douglasii,340885
Callipepla californica, Callipepla californica,340882
Emberiza pusilla, Emberiza pusilla,340338
Psittacula eupatria, Psittacula eupatria,339566
Anas laysanensis, Anas laysanensis,339494
Myiobius villosus, Myiobius villosus,339182
Thamnophilus bernardi, Thamnophilus bernardi,338617
Batara cinerea, Batara cinerea,338586
Poodytes carteri, Poodytes carteri,337762
Locustella luteoventris, Bradypterus luteoventris,337760
Locustella major, Bradypterus major,337758
Cincloramphus cruralis, Cincloramphus cruralis,337752
Harpactes fasciatus, Harpactes fasciatus,336449
Harpactes mackloti, Harpactes mackloti,336439
Caprimulgus batesi, Caprimulgus batesi,336015
Zosterops semiflavus, Zosterops semiflavus,335476
Zosterops abyssinicus, Zosterops abyssinicus,335475
Zosterops flavilateralis, Zosterops abyssinicus flavilateralis,335474
Icterus northropi, Icterus northropi,335470
Granatellus pelzelni, Granatellus pelzelni,335232
Basileuterus lachrymosus, Basileuterus lachrymosus,335230
Cardellina rubra, Cardellina rubra,335229
Conirostrum sitticolor, Conirostrum sitticolor,335227
Catharopeza bishopi, Catharopeza bishopi,335225
Trachyphonus purpuratus, Trachyphonus purpuratus,335017
Illadopsis fulvescens, Illadopsis fulvescens,334360
Eurillas ansorgei, Eurillas ansorgei,334218
Eurillas gracilis, Eurillas gracilis,334217
Bleda canicapillus, Bleda canicapillus,334209
Bleda eximius, Bleda eximius,334206
Graminicola bengalensis, Graminicola bengalensis,333275
Rhopophilus pekinensis, Rhopophilus pekinensis,333272
Phyllergates cucullatus, Phyllergates cucullatus,333264
Gyps tenuirostris, Gyps tenuirostris,332779
Aerodramus vanikorensis, Aerodramus vanikorensis,332662
Nothoprocta ornata, Nothoprocta ornata,332613
Herpsilochmus stictocephalus, Herpsilochmus stictocephalus,332276
Myrmotherula ambigua, Myrmotherula ambigua,332268
Liosceles thoracicus, Liosceles thoracicus,332218
Icterus bullockii, Icterus bullockii,332166
Chloephaga poliocephala, Chloephaga poliocephala,332099
Glaucidium jardinii, Glaucidium jardinii,332039
Jacana jacana, Jacana jacana,332005
Irediparra gallinacea, Irediparra gallinacea,332002
Vanellus miles, Vanellus miles,331997
Gallirallus dieffenbachii, Gallirallus dieffenbachii,331988
Gallirallus sylvestris, Gallirallus sylvestris,331984
Corvus brachyrhynchos, Corvus brachyrhynchos,331952
Dryoscopus gambensis, Dryoscopus gambensis,331949
Tauraco bannermani, Tauraco bannermani,331533
Aegotheles crinifrons, Euaegotheles crinifrons,331489
Aegotheles insignis, Euaegotheles insignis,331487
Aegotheles tatei, Euaegotheles tatei,331479
Charadrius peronii, Charadrius peronii,331466
Charadrius nivosus, Charadrius nivosus,331463
Zosterops superciliosus, Woodfordia superciliosa,330950
Abroscopus albogularis, Abroscopus albogularis,330051
Phaethon aethereus, Phaethon aethereus,330009
Fregata magnificens, Fregata magnificens,330000
Pelecanus occidentalis, Pelecanus occidentalis,329999
Chloropicus griseocephalus, Dendropicos griseocephalus,329876
Chloropicus fuscescens, Dendropicos fuscescens,329875
Picoides arcticus, Picoides arcticus,329874
Odontophorus capueira, Odontophorus capueira,329467
Odontophorus speciosus, Odontophorus speciosus,329460
Odontophorus gujanensis, Odontophorus gujanensis,329457
Treron vernans, Treron vernans,329083
Streptopelia chinensis, Streptopelia chinensis,329078
Zenaida graysoni, Zenaida graysoni,329068
Zenaida galapagoensis, Zenaida galapagoensis,329066
Serinus pusillus, Serinus pusillus,328909
Crithagra citrinelloides, Crithagra citrinelloides,328908
Crithagra citrinipectus, Serinus citrinipectus,328906
Crithagra atrogularis, Serinus atrogularis,328905
Chaetura brachyura, Chaetura brachyura,328797
Sylvietta leucophrys, Sylvietta leucophrys,328520
Sylvia dohrni, Sylvia dohrni,328260
Haliaeetus pelagicus, Haliaeetus pelagicus,327490
Haliaeetus leucoryphus, Haliaeetus leucoryphus,327488
Ictinia plumbea, Ictinia plumbea,327100
Terathopius ecaudatus, Terathopius ecaudatus,327096
Dryotriorchis spectabilis, Dryotriorchis spectabilis,327094
Harpyopsis novaeguineae, Harpyopsis novaeguineae,327091
Nisaetus nanus, Nisaetus nanus,327089
Ortygospiza atricollis, Ortygospiza atricollis,326787
Hypargos niveoguttatus, Hypargos niveoguttatus,326785
Eurocephalus anguitimens, Eurocephalus anguitimens,326783
Lanius senator, Lanius senator,326782
Lagonosticta sanguinodorsalis, Lagonosticta sanguinodorsalis,326779
Clanga clanga, Aquila clanga,325816
Machlolophus holsti, Machlolophus holsti,325806
Cyanomitra olivacea, Cyanomitra olivacea,325639
Coryphospingus cucullatus, Coryphospingus cucullatus,325412
Mimus saturninus, Mimus saturninus,325207
Malurus amabilis, Malurus amabilis,325204
Anser fabalis, Anser fabalis,325140
Lampornis clemenciae, Lampornis clemenciae,324612
Hemignathus wilsoni, Hemignathus wilsoni,324561
Chlorodrepanis flava, Hemignathus flavus,324558
Chlorestes eliciae, Hylocharis eliciae,324467
Leptoptilos javanicus, Leptoptilos javanicus,324163
Ciconia stormi, Ciconia stormi,324162
Ciconia maguari, Ciconia maguari,324161
Ciconia episcopus, Ciconia episcopus,324160
Ciconia boyciana, Ciconia boyciana,324158
Petroica longipes, Petroica longipes,324056
Apus unicolor, Apus unicolor,323632
Apus batesi, Apus batesi,323630
Apus pallidus, Apus pallidus,323626
Callocephalon fimbriatum, Callocephalon fimbriatum,323557
Leucocarbo magellanicus, Leucocarbo magellanicus,323108
Pernis ptilorhynchus, Pernis ptilorhynchus,322730
Pernis celebensis, Pernis celebensis,322728
Chordeiles pusillus, Chordeiles pusillus,322686
Setopagis whitelyi, Setopagis whitelyi,322677
Antrostomus arizonae, Antrostomus arizonae,322674
Pterocles namaqua, Pterocles namaqua,322445
Laniarius turatii, Laniarius turatii,322289
Laniarius ruficeps, Laniarius ruficeps,322286
Telophorus bocagei, Telophorus bocagei,322276
Pionopsitta pileata, Pionopsitta pileata,321389
Spizixos semitorques, Spizixos semitorques,321380
Schoeniparus dubius, Alcippe dubia,321215
Coua serriana, Coua serriana,321160
Neomixis striatigula, Neomixis striatigula,321119
Thraupis cyanoptera, Thraupis cyanoptera,320953
Thraupis ornata, Thraupis ornata,320952
Iridosornis rufivertex, Iridosornis rufivertex,320951
Lophospingus griseocristatus, Lophospingus griseocristatus,320950
Paroaria gularis, Paroaria gularis,320949
Schistochlamys ruficapillus, Schistochlamys ruficapillus,320948
Stephanophorus diadematus, Stephanophorus diadematus,320946
Tangara cyanoventris, Tangara cyanoventris,320945
Stilpnia preciosa, Tangara preciosa,320944
Columba rupestris, Columba rupestris,320359
Phoebastria nigripes, Phoebastria nigripes,320288
Phoebastria immutabilis, Phoebastria immutabilis,320286
Phoebastria albatrus, Phoebastria albatrus,320284
Phoebastria irrorata, Phoebastria irrorata,320282
Thalassarche chrysostoma, Thalassarche chrysostoma,320280
Thalassarche cauta, Thalassarche cauta,320278
Thalassarche melanophris, Thalassarche melanophrys,320271
Crypsirina temia, Crypsirina temia,320099
Dendrocitta formosae, Dendrocitta formosae,320096
Perisoreus internigrans, Perisoreus internigrans,320094
Platysmurus leucopterus, Platysmurus leucopterus,320091
Temnurus temnurus, Temnurus temnurus,320088
Lepidothrix suavissima, Lepidothrix suavissima,319677
Corapipo leucorrhoa, Corapipo leucorrhoa,319674
Pterodroma baraui, Pterodroma baraui,319472
Pterodroma nigripennis, Pterodroma nigripennis,319464
Chasiempis sclateri, Chasiempis sclateri,319312
Chasiempis ibidis, Chasiempis sandwichensis ibidis,319311
Telophorus dohertyi, Telophorus dohertyi,319144
Tityra semifasciata, Tityra semifasciata,319142
Strepera graculina, Strepera graculina,319139
Sphecotheres viridis, Sphecotheres vieilloti,319134
Sphecotheres vieilloti, Sphecotheres vieilloti,319134
Cygnus melancoryphus, Cygnus melancoryphus,318892
Crithagra burtoni, Crithagra burtoni,318589
Corvus bennetti, Corvus bennetti,318529
Corvus capensis, Corvus capensis,318522
Amaurornis phoenicurus, Amaurornis phoenicurus,318444
