ORIGINAL LABEL, OTT TAXON NAME, OTT TAXON ID
Saroglossa spilopterus, Psaroglossa spiloptera,7663542
Strigops habroptila, Strigops greyii,7663184
Caloramphus hayii, Caloramphus hayii,7662947
Yungipicus kizuki, Yungipicus kizuki,7662877
Dendrocoptes auriceps, Dendrocoptes auriceps,7662873
Euscarthmus fulviceps, Euscarthmus fulviceps,7662575
Turdus murinus, Turdus murinus,7662510
Saltator olivascens, Saltator olivascens,7662425
Saltator grandis, Saltator grandis,7662418
Thlypopsis superciliaris, Thlypopsis superciliaris,7662409
Sporophila morelleti, Sporophila morelleti,7662403
Sporathraupis cyanocephala, Sporathraupis cyanocephala,7662399
Saltatricula atricollis, Saltatricula atricollis,7662396
Poospiza rufosuperciliaris, Poospiza rufosuperciliaris,7662385
Poospiza goeringi, Poospiza goeringi,7662383
Idiopsar speculifer, Idiopsar speculifer,7662365
Conirostrum binghami, Conirostrum binghami,7662342
Herpsilochmus frater, Herpsilochmus frater,7662296
Zosterops auriventer, Zosterops auriventer,7662248
Zosterops anjuanensis, Zosterops anjuanensis,7662242
Zosterops anderssoni, Zosterops anderssoni,7662241
Turdoides nipalensis, Timalia nipalensis,7662232
Stachyris roberti, Stachyris roberti,7662228
Iole crypta, Iole crypta,7662003
Iole cacharensis, Iole cacharensis,7662002
Brachypodius fuscoflavescens, Brachypodius fuscoflavescens,7661984
Phylloscopus whistleri, Phylloscopus whistleri,7661975
Phylloscopus valentini, Phylloscopus valentini,7661974
Phylloscopus tephrocephalus, Phylloscopus tephrocephalus,7661972
Phylloscopus soror, Phylloscopus soror,7661971
Phylloscopus poliogenys, Phylloscopus poliogenys,7661968
Phylloscopus omeiensis, Phylloscopus omeiensis,7661966
Phylloscopus intermedius, Phylloscopus intermedius,7661965
Phylloscopus castaniceps, Phylloscopus castaniceps,7661961
Phylloscopus burkii, Phylloscopus burkii,7661959
Helopsaltes pryeri, Helopsaltes pryeri,7661935
Helopsaltes ochotensis, Helopsaltes ochotensis,7661934
Helopsaltes fasciolatus, Helopsaltes fasciolatus,7661933
Helopsaltes certhiola, Helopsaltes certhiola,7661932
Helopsaltes amnicola, Helopsaltes amnicola,7661931
Pterorhinus vassali, Pterorhinus vassali,7661913
Pterorhinus sannio, Pterorhinus sannio,7661912
Pterorhinus poecilorhynchus, Pterorhinus poecilorhynchus,7661911
Pterorhinus perspicillatus, Pterorhinus perspicillatus,7661910
Pterorhinus pectoralis, Pterorhinus pectoralis,7661909
Pterorhinus lanceolatus, Pterorhinus lanceolatus,7661908
Pterorhinus gularis, Pterorhinus gularis,7661907
Pterorhinus davidi, Pterorhinus davidi,7661906
Pterorhinus chinensis, Pterorhinus chinensis,7661905
Pterorhinus albogularis, Pterorhinus albogularis,7661904
Argya gularis, Argya gularis,7661877
Prinia rufifrons, Prinia rufifrons,7661836
Spizocorys fremantlii, Spizocorys fremantlii,7661765
Eremopterix hova, Eremopterix hova,7661738
Aplonis ulietensis, Aplonis ulietensis,7661681
Lamprolia klinesmithi, Lamprolia klinesmithi,7661621
Scytalopus perijanus, Scytalopus perijanus,7661617
Scytalopus alvarezlopezi, Scytalopus alvarezlopezi,7661615
Pitta vigorsii, Pitta vigorsii,7661603
Pitta concinna, Pitta concinna,7661592
Machaeropterus eckelberryi, Machaeropterus eckelberryi,7661579
Foudia delloni, Foudia delloni,7661523
Passer cinnamomeus, Passer cinnamomeus,7661508
Basileuterus tacarcunae, Basileuterus tacarcunae,7661473
Basileuterus melanotis, Basileuterus melanotis,7661467
Leptocoma aspasia, Leptocoma aspasia,7661432
Anthus peruvianus, Anthus peruvianus,7661349
Anthus nicholsoni, Anthus nicholsoni,7661345
Leistes superciliaris, Leistes superciliaris,7661299
Leistes loyca, Leistes loyca,7661298
Leistes defilippii, Leistes defilippii,7661296
Cyanoloxia brissonii, Cyanoloxia brissonii,7661234
Crithagra hyposticta, Crithagra hyposticta,7661222
Loxia sinesciuris, Loxia sinesciuris,7661197
Junco bairdi, Junco bairdi,7661072
Arremon dorbignii, Arremon dorbignii,7661048
Sittiparus owstoni, Sittiparus owstoni,7661041
Sittiparus olivaceus, Sittiparus olivaceus,7661040
Sittiparus castaneoventris, Sittiparus castaneoventris,7661039
Myrmecocichla monticola, Myrmecocichla monticola,7660947
Melaenornis semipartitus, Melaenornis semipartitus,7660874
Melaenornis herero, Melaenornis herero,7660873
Fraseria tessmanni, Fraseria tessmanni,7660867
Fraseria plumbea, Fraseria plumbea,7660866
Fraseria olivascens, Fraseria olivascens,7660865
Fraseria lendu, Fraseria lendu,7660864
Fraseria griseigularis, Fraseria griseigularis,7660863
Fraseria caerulescens, Fraseria caerulescens,7660862
Ficedula ruficauda, Ficedula ruficauda,7660860
Ficedula erithacus, Ficedula hodgsoni,7660859
Ficedula hodgsoni, Ficedula hodgsoni,7660859
Cyornis whitei, Cyornis whitei,7660848
Bradornis ussheri, Bradornis ussheri,7660813
Bradornis fuliginosus, Bradornis fuliginosus,7660811
Bradornis comitatus, Bradornis comitatus,7660810
Bradornis boehmi, Bradornis boehmi,7660809
Foulehaio taviunensis, Foulehaio taviunensis,7660735
Amytornis whitei, Amytornis whitei,7660718
Amytornis rowleyi, Amytornis rowleyi,7660717
Asthenes berlepschi, Asthenes berlepschi,7660580
Lophorina niedda, Lophorina niedda,7660449
Pachycephala balim, Pachycephala balim,7660419
Myiagra castaneigularis, Myiagra castaneigularis,7660374
Urocissa erythroryncha, Urocissa erythroryncha,7660284
Henicorhina anachoreta, Henicorhina anachoreta,7660055
Cantorchilus zeledoni, Cantorchilus zeledoni,7660049
Polioptila albiventris, Polioptila albiventris,7660032
Zapornia paykullii, Zapornia paykullii,7660005
Zapornia palmeri, Zapornia palmeri,7660004
Zapornia olivieri, Zapornia olivieri,7660003
Zapornia monasa, Zapornia monasa,7660002
Zapornia fusca, Zapornia fusca,7660001
Zapornia flavirostra, Zapornia flavirostra,7660000
Zapornia bicolor, Zapornia bicolor,7659999
Zapornia atra, Zapornia atra,7659998
Zapornia akool, Zapornia akool,7659997
Porphyrio paepae, Porphyrio paepae,7659959
Paragallinula angulata, Paragallinula angulata,7659948
Mundia elpenor, Atlantisia elpenor,7659899
Aramides albiventris, Aramides albiventris,7659896
Amaurornis marginalis, Amaurornis marginalis,7659895
Antigone vipio, Antigone vipio,7659876
Antigone rubicunda, Antigone rubicunda,7659875
Chrysococcyx minutillus, Chrysococcyx minutillus,7659410
Turacoena sulaensis, Turacoena sulaensis,7659238
Ptilinopus ponapensis, Ptilinopus ponapensis,7659228
Ptilinopus hernsheimi, Ptilinopus hernsheimi,7659226
Macropygia modiglianii, Macropygia modiglianii,7659212
Macropygia macassariensis, Macropygia macassariensis,7659210
Macropygia doreya, Macropygia doreya,7659205
Macropygia cinnamomea, Macropygia cinnamomea,7659204
Alopecoenas stairi, Caloenas stairi,7659142
Anous ceruleus, Anous ceruleus,7659019
Anous albivitta, Anous albivitta,7659018
Schistes albogularis, Schistes albogularis,7658877
Saucerottia tobaci, Saucerottia tobaci,7658876
Saucerottia cyanifrons, Saucerottia cyanifrons,7658871
Saucerottia beryllina, Saucerottia beryllina,7658869
Lophornis stictolophus, Lophornis verreauxi,7658846
Colibri cyanotus, Colibri cyanotus,7658788
Collocalia sumbawae, Collocalia sumbawae,7658715
Collocalia neglecta, Collocalia neglecta,7658712
Collocalia natalis, Collocalia natalis,7658711
Collocalia isonota, Collocalia isonota,7658709
Aviceda madagascariensis, Aviceda madagascariensis,7658528
Aulacorhynchus whitelianus, Aulacorhamphus whitelianus,7658001
Ninox rotiensis, Ninox boobook rotiensis,7068891
Ninox fusca, Ninox boobook fusca,7068888
Eudyptes moseleyi, Eudyptes moseleyi,7068880
Trichoglossus moluccanus, Trichoglossus moluccanus,7068808
Saudareos meyeri, Trichoglossus flavoviridis meyeri,7068793
Saudareos flavoviridis, Trichoglossus flavoviridis flavoviridis,7068792
Procellaria conspicillata, Procellaria conspicillata,7068755
Pachyptila crassirostris, Pachyptila crassirostris,7068753
Hydrobates cheimomnestes, Hydrobates cheimomnestes,7068745
Ochthoeca leucophrys, Ochthoeca leucophrys,7068707
Nephelomyias pulcher, Nephelomyias pulcher,7068706
Nephelomyias lintoni, Nephelomyias lintoni,7068705
Turdus arthuri, Turdus ignobilis arthuri,7068698
Catharus maculatus, Catharus dryas maculatus,7068690
Myrmoderus eowilsoni, Myrmoderus eowilsoni,7068687
Myrmelastes brunneiceps, Myrmelastes brunneiceps,7068686
Zosterops melanurus, Zosterops melanurus,7068672
Zosterops lacertosus, Zosterops lacertosus,7068671
Tephrozosterops stalkeri, Tephrozosterops stalkeri,7068667
Sterrhoptilus nigrocapitatus, Sterrhoptilus nigrocapitatus,7068666
Sterrhoptilus dennistouni, Sterrhoptilus dennistouni,7068665
Sterrhoptilus capitalis, Sterrhoptilus capitalis,7068664
Dasycrotapha plateni, Dasycrotapha plateni,7068663
Mixornis flavicollis, Mixornis flavicollis,7068660
Mixornis bornensis, Mixornis bornensis,7068659
Macronus ptilosus, Macronus ptilosus,7068653
Curruca deserti, Curruca nana,7068651
Pycnonotus pseudosimplex, Pycnonotus pseudosimplex,7068638
Ixos virescens, Ixos virescens,7068636
Arizelocichla montana, Arizelocichla montana,7068635
Phylloscopus maforensis, Seicercus maforensis,7068632
Turdinus macrodactylus, Turdinus macrodactylus,7068627
Schoeniparus variegaticeps, Schoeniparus variegaticeps,7068623
Trochalopteron virgatum, Trochalopteron virgatum,7068604
Trochalopteron morrisonianum, Trochalopteron morrisonianum,7068600
Trochalopteron formosum, Trochalopteron formosum,7068594
Argya subrufa, Argya subrufa,7068535
Argya altirostris, Argya altirostris,7068525
Prinia rocki, Prinia polychroa rocki,7068514
Prinia cooki, Prinia polychroa cooki,7068512
Horornis fortipes, Horornis fortipes,7068504
Emberiza rustica, Emberiza rustica,7068450
Ammospiza leconteii, Ammospiza leconteii,7068415
Chamaetylas poliocephala, Chamaetylas poliocephala,7068385
Brachypteryx sinensis, Brachypteryx sinensis,7068384
Brachypteryx goodfellowi, Brachypteryx goodfellowi,7068381
Brachypteryx cruralis, Brachypteryx cruralis,7068380
Cissomela pectoralis, Cissomela pectoralis,7068375
Sarcophanops steerii, Sarcophanops steerii,7068359
Pachycephala melanorhyncha, Colluricincla megarhyncha melanorhyncha,7068332
Dicrurus sharpei, Dicrurus ludwigii sharpei,7068322
Dicrurus divaricatus, Dicrurus adsimilis divaricatus,7068321
Pica mauritanica, Pica pica mauritanica,7068315
Cantorchilus longirostris, Cantorchilus longirostris,7068223
Ramphocaenus sticturus, Ramphocaenus melanurus sticturus,7068218
Polioptila bilineata, Polioptila bilineata,7068185
Goura sclaterii, Goura sclaterii,7068117
Systellura longirostris, Systellura longirostris,7068108
Oreotrochilus cyanolaemus, Oreotrochilus cyanolaemus,7068104
Collocalia uropygialis, Collocalia uropygialis,7068096
Collocalia affinis, Collocalia affinis,7068093
Mareca marecula, Mareca marecula,6520322
Melanitta stejnegeri, Melanitta stejnegeri,6520321
Ortalis columbiana, Ortalis columbiana,6520320
Ortalis araucuan, Ortalis araucuan,6520319
Ortalis squamata, Ortalis squamata,6520318
Columba thiriouxi, Columba thiriouxi,6520316
Nesoenas duboisi, Nesoenas duboisi,6520315
Nesoenas cicur, Nesoenas cicur,6520314
Nesoenas rodericanus, Nesoenas rodericanus,6520313
Treron axillaris, Treron axillaris,6520312
Treron griveaudi, Treron griveaudi,6520311
Hierococcyx bocki, Hierococcyx bocki,6520310
Systellura decussata, Systellura decussata,6520309
Setopagis heterura, Setopagis heterura,6520308
Urochroa leucura, Urochroa leucura,6520307
Campylopterus calcirupicola, Campylopterus calcirupicola,6520306
Nycticorax mauritianus, Nycticorax mauritianus,6520305
Nycticorax duboisi, Nycticorax duboisi,6520304
Nycticorax megacephalus, Nycticorax megacephalus,6520303
Nyctanassa carcinocatactes, Nyctanassa carcinocatactes,6520302
Bermuteo avivorus, Bermuteo avivorus,6520301
Otus siaoensis, Otus siaoensis,6520300
Otus sulaensis, Otus sulaensis,6520299
Megascops gilesi, Megascops gilesi,6520298
Tyto deroepstorffi, Tyto deroepstorffi,6520297
Psilopogon auricularis, Psilopogon auricularis,6520295
Dinopium psarodes, Dinopium psarodes,6520294
Colaptes oceanicus, Colaptes oceanicus,6520292
Eclectus infectus, Eclectus infectus,6520291
Lophopsittacus mauritianus, Lophopsittacus mauritianus,6520290
Necropsittacus rodricanus, Necopsittacus rodricanus,6520289
Psittacara maugei, Psittacara maugei,6520288
Psittacara labati, Psittacara labati,6520287
Cercomacroides fuscicauda, Cercomacroides fuscicauda,6520286
Myrmothera subcanescens, Myrmothera subcanescens,6520285
Automolus exsertus, Automolus exsertus,6520284
Schiffornis olivacea, Schiffornis olivacea,6520283
Myzomela irianawidodoae, Myzomela irianawidodoae,6520282
Rhipidura sulaensis, Rhipidura sulaensis,6520281
Dicrurus occidentalis, Dicrurus occidentalis,6520280
Dicrurus atactus, Dicrurus atactus,6520279
Pica asirensis, Pica asirensis,6520278
Pica bottanensis, Pica bottanensis,6520277
Pycnonotus snouckaerti, Pycnonotus snouckaerti,6520276
Phylloscopus intensior, Phylloscopus intensior,6520275
Phylloscopus rotiensis, Phylloscopus rotiensis,6520274
Zosterops eurycricotus, Zosterops eurycricotus,6520273
Erythrogenys erythrocnemis, Megapomatorhinus erythrocnemis,6520272
Pterorhinus woodi, Ianthocincla woodi,6520271
Cyornis sumatrensis, Cyornis sumatrensis,6520270
Cyornis pelingensis, Cyornis pelingensis,6520269
Calliope tschebaiewi, Calliope tschebaiewi,6520268
Cinnyris gertrudis, Cinnyris gertrudis,6520267
Passer zarudnyi, Passer zarudnyi,6520266
Emberiza calandra, Emberiza calandra,6520265
Leistes bellicosus, Leistes bellicosus,6520264
Alopochen mauritiana, Alopochen mauritiana,6520262
Alopecoenas ferrugineus, Alopecoenas ferrugineus,6520261
Alopecoenas norfolkensis, Alopecoenas norfolkensis,6520260
Alectroenas payandeei, Alectroenas payandeei,6520259
Celeus ochraceus, Celeus ochraceus,6520258
Stephanoxis loddigesii, Stephanoxis loddigesii,6155517
Oxypogon stuebelii, Oxypogon stubelii,6155494
Oxypogon lindenii, Oxypogon lindenii,6155493
Oxypogon cyanolaemus, Oxypogon cyanolaemus,6155492
Eugenes spectabilis, Eugenes spectabilis,6155459
Anthocephala berlepschi, Anthocephala berlepschi,6155420
Otus jolandae, Otus jolandae,6155348
Ninox spilonotus, Ninox spilonotus,6155337
Ninox rumseyi, Ninox rumseyi,6155336
Ninox reyi, Ninox reyi,6155333
Ninox leventisi, Ninox leventisi,6155329
Aegolius gradyi, Aegolius gradyi,6155275
Hydrobates socorroensis, Hydrobates socorroensis,6155061
Oceanites pincoyae, Oceanites pincoyae,6155057
Dinopium everetti, Dinopium everetti,6154973
Chrysocolaptes guttacristatus, Chrysocolaptes guttacristatus,6154938
Chrysocolaptes erythrocephalus, Chrysocolaptes erythrocephalus,6154937
Psilopogon zeylanicus, Psilopogon zeylanicus,6154915
Psilopogon viridis, Psilopogon viridis,6154914
Psilopogon virens, Psilopogon virens,6154913
Psilopogon rubricapillus, Psilopogon rubricapillus,6154912
Psilopogon rafflesii, Psilopogon rafflesii,6154911
Psilopogon pulcherrimus, Psilopogon pulcherrimus,6154910
Psilopogon mystacophanos, Psilopogon mystacophanos,6154908
Psilopogon monticola, Psilopogon monticola,6154907
Psilopogon malabaricus, Psilopogon malabaricus,6154906
Psilopogon lineatus, Psilopogon lineatus,6154905
Psilopogon lagrandieri, Psilopogon lagrandieri,6154904
Psilopogon javensis, Psilopogon javensis,6154903
Psilopogon incognitus, Psilopogon incognitus,6154902
Psilopogon henricii, Psilopogon henricii,6154901
Psilopogon franklinii, Psilopogon franklinii,6154899
Psilopogon flavifrons, Psilopogon flavifrons,6154898
Psilopogon faiostrictus, Psilopogon faiostrictus,6154897
Psilopogon faber, Psilopogon faber,6154896
Psilopogon eximius, Psilopogon eximius,6154895
Psilopogon duvaucelii, Psilopogon duvaucelii,6154894
Psilopogon corvinus, Psilopogon corvinus,6154893
Psilopogon chrysopogon, Psilopogon chrysopogon,6154891
Psilopogon chersonesus, Psilopogon chersonesus,6154890
Psilopogon australis, Psilopogon australis,6154889
Psilopogon asiaticus, Psilopogon asiaticus,6154888
Psilopogon armillaris, Psilopogon armillaris,6154887
Psilopogon annamensis, Psilopogon annamensis,6154886
Zosterops ponapensis, Zosterops ponapensis,6154690
Zosterops comorensis, Zosterops comorensis,6154676
Zosterops aldabrensis, Zosterops aldabrensis,6154673
Zimmerius chicomendesi, Zimmerius chicomendesi,6154659
Sirystes subcanescens, Sirystes subcanescens,6154637
Sirystes albocinereus, Sirystes albocinereus,6154635
Knipolegus cabanisi, Knipolegus cabanisi,6154553
Hemitriccus cohnhafti, Hemitriccus cohnhafti,6154543
Zoothera salimalii, Zoothera salimalii,6154512
Zoothera griseiceps, Zoothera griseiceps,6154509
Zoothera atrigena, Zoothera atrigena,6154508
Turdoides rufocinctus, Turdoides rufocincta,6154420
Turdoides gilberti, Turdoides gilberti,6154411
Turdoides chapini, Turdoides chapini,6154408
Turdoides atripennis, Turdoides atripennis,6154407
Stachyris humei, Stachyris humei,6154399
Pnoepyga mutica, Pnoepyga mutica,6154375
Pellorneum rostratum, Pellorneum rostratum,6154373
Pellorneum cinereiceps, Pellorneum cinereiceps,6154371
Pellorneum celebense, Pellorneum celebense,6154370
Pellorneum bicolor, Pellorneum bicolor,6154368
Robsonius thompsoni, Robsonius thompsoni,6154365
Napothera pasquieri, Napothera pasquieri,6154364
Napothera malacoptila, Napothera malacoptila,6154363
Napothera danjoui, Napothera danjoui,6154359
Napothera albostriata, Napothera albostriata,6154358
Illadopsis turdina, Illadopsis turdina,6154342
Dubusia castaneoventris, Dubusia castaneoventris,6154283
Thlypopsis pyrrhocoma, Thlypopsis pyrrhocoma,6154276
Sporophila nuttingi, Sporophila nuttingi,6154268
Sporophila funerea, Sporophila funerea,6154262
Sporophila fringilloides, Sporophila fringilloides,6154261
Sporophila beltoni, Sporophila beltoni,6154255
Sporophila atrirostris, Sporophila atrirostris,6154254
Sicalis mendozae, Sicalis mendozae,6154250
Acanthidops bairdi, Acanthidops bairdi,6154181
Thamnistes rufescens, Thamnistes rufescens,6154178
Epinecrophylla amazonica, Epinecrophylla amazonica,6154109
Graminicola striatus, Graminicola striatus,6154057
Rhipidura sauli, Rhipidura sauli,6153922
Rhipidura nigritorquis, Rhipidura nigritorquis,6153920
Scytalopus gonzagai, Scytalopus gonzagai,6153902
Rhabdornis rabori, Rhabdornis rabori,6153892
Pycnonotus conradi, Pycnonotus conradi,6153868
Alophoixus platenae, Alophoixus platenae,6153822
Alophoixus mystacalis, Alophoixus mystacalis,6153821
Alophoixus lucasi, Alophoixus lucasi,6153820
Alophoixus longirostris, Alophoixus longirostris,6153819
Alophoixus chloris, Alophoixus chloris,6153816
Alophoixus aureus, Alophoixus aureus,6153814
Ailuroedus stonii, Ailuroedus stonii,6153806
Ailuroedus melanocephalus, Ailuroedus melanocephalus,6153803
Ailuroedus maculosus, Ailuroedus maculosus,6153802
Ailuroedus jobiensis, Ailuroedus jobiensis,6153799
Ailuroedus geislerorum, Ailuroedus geislerorum,6153796
Ailuroedus astigmaticus, Ailuroedus astigmaticus,6153792
Ailuroedus arfakianus, Ailuroedus arfakianus,6153789
Schiffornis veraepacis, Schiffornis veraepacis,6153776
Schiffornis stenorhyncha, Schiffornis stenorhyncha,6153775
Schiffornis aenea, Schiffornis aenea,6153773
Petroica pusilla, Petroica pusilla,6153726
Drymodes beccarii, Drymodes beccarii,6153709
Myiothlypis basilica, Myiothlypis basilica,6153625
Aethopyga tibolii, Aethopyga tibolii,6153550
Aethopyga magnifica, Aethopyga magnifica,6153549
Aethopyga jefferyi, Aethopyga jefferyi,6153548
Aethopyga guimarasensis, Aethopyga guimarasensis,6153547
Aethopyga decorosa, Aethopyga decorosa,6153544
Agelaioides fringillarius, Agelaioides fringillarius,6153484
Cacicus latirostris, Cacicus latirostris,6153462
Cyanoloxia rothschildii, Cyanoloxia rothschildii,6153378
Artemisiospiza nevadensis, Artemisiospiza nevadensis,6153372
Loxops wolstenholmei, Loxops wolstenholmei,6153368
Loxops ochraceus, Loxops ochraceus,6153367
Himatione fraithii, Himatione fraithii,6153366
Hemignathus hanapepe, Hemignathus hanapepe,6153365
Hemignathus affinis, Hemignathus affinis,6153364
Carpodacus waltoni, Carpodacus waltoni,6153321
Carpodacus stoliczkae, Carpodacus stoliczkae,6153320
Akialoa lanaiensis, Akialoa lanaiensis,6153307
Pipilo naufragus, Pipilo naufragus,6153177
Acanthiza cinerea, Acanthiza cinerea,6153071
Muscicapa williamsoni, Muscicapa williamsoni,6153023
Ficedula luzoniensis, Ficedula luzoniensis,6152992
Cyanoptila cumatilis, Cyanoptila cumatilis,6152972
Copsychus superciliaris, Copsychus superciliaris,6152961
Myzomela nigriventris, Myzomela nigriventris,6152890
Gymnomyza brunneirostris, Gymnomyza brunneirostris,6152859
Gliciphila undulata, Gliciphila undulata,6152858
Gliciphila notabilis, Gliciphila notabilis,6152857
Foulehaio procerior, Foulehaio procerior,6152852
Actinodura strigula, Actinodura strigula,6152760
Actinodura cyanouroptera, Actinodura cyanouroptera,6152756
Thripophaga amacurensis, Thripophaga amacurensis,6152717
Clibanornis rufipectus, Clibanornis rufipectus,6152655
Clibanornis rectirostris, Clibanornis rectirostris,6152653
Clibanornis erythrocephalus, Clibanornis erythrocephalus,6152652
Cichlocolaptes mazarbarnetti, Cichlocolaptes mazarbarnetti,6152648
Automolus subulatus, Automolus subulatus,6152644
Anabacerthia lichtensteini, Anabacerthia lichtensteini,6152626
Grallaricula leymebambae, Grallaricula leymebambae,6152617
Vireo sclateri, Vireo sclateri,6152535
Vireo chivi, Vireo chivi,6152528
Platysteira hormophora, Platysteira hormophora,6152492
Lophorina minor, Lophorina minor,6152475
Pitohui uropygialis, Pitohui uropygialis,6152467
Pitohui cerviniventris, Pitohui cerviniventris,6152465
Pachycephala richardsi, Pachycephala richardsi,6152454
Pachycephala fuliginosa, Pachycephala fuliginosa,6152442
Pachycephala collaris, Pachycephala collaris,6152440
Terpsiphone incei, Terpsiphone incei,6152425
Terpsiphone affinis, Terpsiphone affinis,6152418
Carterornis castus, Carterornis castus,6152394
Lanius borealis, Lanius borealis,6152355
Cissa jefferyi, Cissa jefferyi,6152255
Lalage typica, Lalage typica,6152233
Lalage polioptera, Lalage polioptera,6152231
Lalage melaschistos, Lalage melaschistos,6152228
Lalage melanoptera, Lalage melanoptera,6152227
Lalage fimbriata, Lalage fimbriata,6152225
Rhopophilus albosuperciliaris, Rhopophilus albosuperciliaris,6152177
Laticilla cinerascens, Laticilla cinerascens,6152155
Cinclus schulzii, Cinclus schulzii,6152109
Horornis haddeni, Horornis haddeni,6152101
Cantorchilus elutus, Cantorchilus elutus,6152064
Dryolimnas augusti, Dryolimnas augusti,6151916
Penelope bridgesi, Penelope bridgesi,6151696
Nystalus obamai, Nystalus obamai,6151598
Falco duboisi, Falco duboisi,6151549
Parabuteo leucorrhous, Parabuteo leucorrhous,6151524
Haliaeetus ichthyaetus, Haliaeetus ichthyaetus,6151508
Haliaeetus humilis, Haliaeetus humilis,6151507
Buteogallus lacernulatus, Buteogallus lacernulatus,6151492
Buteogallus coronatus, Buteogallus coronatus,6151491
Buteo plagiatus, Buteo plagiatus,6151487
Cacomantis aeruginosus, Cacomantis aeruginosus,6151422
Merops americanus, Merops americanus,6151385
Coracias affinis, Coracias affinis,6151371
Todiramphus tristrami, Todiramphus tristrami,6151363
Todiramphus sacer, Todiramphus sacer,6151360
Todiramphus reichenbachii, Todiramphus reichenbachii,6151359
Todiramphus pelewensis, Todiramphus pelewensis,6151358
Todiramphus colonus, Todiramphus colonus,6151352
Halcyon gularis, Halcyon gularis,6151339
Ceyx wallacii, Ceyx wallacii,6151332
Ceyx uropygialis, Ceyx uropygialis,6151331
Ceyx solitarius, Ceyx solitarius,6151330
Ceyx sacerdotis, Ceyx sacerdotis,6151329
Ceyx pallidus, Ceyx pallidus,6151328
Ceyx nigromaxilla, Ceyx nigromaxilla,6151327
Ceyx mulcatus, Ceyx mulcatus,6151325
Ceyx meeki, Ceyx meeki,6151322
Ceyx margarethae, Ceyx margarethae,6151321
Ceyx malaitae, Ceyx malaitae,6151320
Ceyx gentianus, Ceyx gentianus,6151319
Ceyx flumenicola, Ceyx flumenicola,6151318
Ceyx dispar, Ceyx dispar,6151317
Ceyx collectoris, Ceyx collectoris,6151315
Ceyx cajeli, Ceyx cajeli,6151314
Streptopelia dusumieri, Streptopelia dusumieri,6151277
Macropygia timorlaoensis, Macropygia timorlaoensis,6151238
Ducula luctuosa, Ducula luctuosa,6151198
Calidris virgata, Calidris virgata,6151078
Synthliboramphus scrippsi, Synthliboramphus scrippsi,6150946
Eurostopodus nigripennis, Eurostopodus nigripennis,6150925
Eurostopodus exul, Eurostopodus exul,6150924
Caprimulgus phalaena, Caprimulgus phalaena,6150904
Rhyticeros cassidix, Rhyticeros cassidix,6150877
Geospiza propinqua, Geospiza propinqua,5991470
Geospiza acutirostris, Geospiza acutirostris,5991469
Otus cyprius, Otus scops cyprius,5925791
Mulleripicus fuliginosus, Mulleripicus fuliginosus,5925777
Pyrocephalus nanus, Pyrocephalus nanus,5925763
Locustella idonea, Locustella idonea,5925744
Locustella chengi, Locustella chengi,5925743
Calandrella eremica, Calandrella blanfordi eremica,5925706
Montecincla meridionalis, Montecincla meridionalis,5925694
Montecincla jerdoni, Montecincla jerdoni,5925693
Asthenes ayacuchensis, Asthenes vilcabambae ayacuchensis,5925688
Tetrao urogalloides, Tetrao urogalloides,5925680
Symposiachrus rubiensis, Symposiachrus rubiensis,5861452
Bambusicola sonorivox, Bambusicola thoracicus sonorivox,5861117
Pternistis atrifrons, Francolinus castaneicollis atrifrons,5861116
Todiramphus sordidus, Todiramphus sordidus,5859986
Todiramphus albicilla, Todiramphus albicilla,5859984
Ficedula owstoni, Ficedula narcissina owstoni,5859958
Muscicapa dauurica, Muscicapa dauurica,5859956
Geospiza septentrionalis, Geospiza difficilis septentrionalis,5859950
Passer castanopterus, Passer castanopterus,5859927
Platysteira blissetti, Platysteira blissetti,5859905
Pachycephala chlorura, Pachycephala chlorura,5859901
Pachycephala feminina, Pachycephala feminina,5859900
Cinclosoma clarum, Cinclosoma clarum,5859898
Sarkidiornis sylvicola, Sarkidiornis sylvicola,5859876
Thalasseus albididorsalis, Thalasseus maximus albididorsalis,5859773
Chrysocolaptes xanthocephalus, Chrysocolaptes lucidus xanthocephalus,5859742
Chrysocolaptes strictus, Chrysocolaptes lucidus strictus,5859741
Coracias spatulatus, Coracias spatulatus,5857415
Todiramphus winchelli, Todiramphus winchelli,5857394
Todiramphus ruficollaris, Todiramphus ruficollaris,5857393
Todiramphus gertrudae, Todiramphus gertrudae,5857392
Muscicapa sodhii, Muscicapa sodhii,5857382
Sporophila pileata, Sporophila pileata,5857373
